"doi","journal","publication_date.x","article_type","financial_disclosure","title_display","score","grantID1","grantID2","grantID3","grantID4","publication_date.y","title","biod","citeulike","crossref","scopus","pubmed","researchblogging","nature","bloglines","postgenomic","facebook","twitter","wikipedia","counter_html","counter_pdf","counter_xml","counter","pmc_html","pmc_pdf","pmc","mendeley_readers","mendeley_groups","mendeley","comments","comment_replies","notes","note_replies","ratings","avg_rating","rating_comments","trackbacks"
"10.1371/journal.pbio.0060220","PLoS Biology","26/08/2008","Primer","Our research, upon which this Primer is based, is supported by Human Frontier Science Program grant RG0043/2004-C, European Community FP7 grant BIOTACT (ICT-215910), Ministero per l'Istruzione, l'Universit,"Whisker-Mediated Texture Discrimination",1,215910,NA,NA,NA,"2008-08-26","Whisker-Mediated Texture Discrimination",0,2,11,8,5,0,0,0,1,0,0,0,1964,580,47,2591,412,205,617,25,4,29,0,0,0,0,0,0,0,0
"10.1371/journal.pbio.1000131","PLoS Biology","23/06/2009","Research Article","Funding to CM, RAM, and BW was provided by the Sloan Foundation through the Future of Marine Animal Populations Project. KJG holds a Royal Society-Wolfson Research Merit Award. Funding to RUS was provided by the Pew Fellowship for Marine Conservation. Funding to DZ, RUS, and RW was provided by the Pew Charitable Trust, Philadelphia through the Sea Around Us Project. Funding to MC was provided by the European Community's Seventh Framework Programme FP7/2007-2013 under grant agreement #GA-2008-219265 for the implementation of ECOFUN Project. The funders had no role in study design, data collection and analysis, decision to publish, or preparation of the manuscript.","Management Effectiveness of the World's Marine Fisheries",1,219265,NA,NA,NA,"2009-06-23","Management Effectiveness of the World's Marine Fisheries",60,3,36,52,2,1,0,0,0,13,3,0,20637,4912,66,25615,413,263,676,0,0,0,1,0,1,1,0,0,0,0
"10.1371/journal.pbio.1000173","PLoS Biology","18/08/2009","Research Article","This work was supported by Human Frontier Science Program grant RGP0127/2001, NWO-VICI grant 918.46.609, Senter Novem BSIK grant 03053 and EU grant FP7, #217148 to CMAP and grant MH046823 from the National Institute of Mental Health to BLM. The funders had no role in study design, data collection and analysis, decision to publish, or preparation of the manuscript.","Hippocampus Leads Ventral Striatum in Replay of Place-Reward Information",1,217148,NA,NA,NA,"2009-08-18","Hippocampus Leads Ventral Striatum in Replay of Place-Reward Information",0,9,36,45,17,0,0,0,0,0,0,0,3416,1089,27,4532,482,355,837,0,0,0,0,0,0,0,0,0,0,0
"10.1371/journal.pbio.1000181","PLoS Biology","01/09/2009","Research Article","This research was supported by the Swiss National Foundation (through an individual research grant to U.S. and the National Center of Competence in Research Program Frontiers in Genetics), the State of Geneva, the Louis Jeantet Foundation of Medicine, the Bonizzi-Theler Stiftung, and the 6th European Framework Project EUCLOCK. D. G. received long-term fellowships from The Federation of European Biochemical Societies (FEBS) and The International Human Frontier Science Program Organization (HFSP). Research in A. M.'s laboratory is funded by the Italian Association for Cancer Research (AIRC, Milan, Italy), the European Research Council Starting Independent Grant - IDEAS 2008, the European Community's Seventh Framework Programme FP7/2007 - 20013 under Grant Agreement No. 202272 (LipidomicNet), Italian Ministry of Health and Education (Finanziamenti per la Ricerca di Base), Cariplo Fundation Milan, Telethon Fundation (GGP08259). G. Lo Sasso is a fellow of AIRC-FIRC (Milan, Italy). Thierry Claudel was supported by the SFB LIPOTOX, grant n,"REV-ERB,1,202272,NA,NA,NA,"2009-09-01","REV-ERB? Participates in Circadian SREBP Signaling and Bile Acid Homeostasis",0,0,42,63,33,0,0,0,0,3,0,1,4544,1421,40,6005,1282,763,2045,28,3,31,0,0,0,0,0,0,0,0
"10.1371/journal.pbio.1000260","PLoS Biology","22/12/2009","Research Article","This work was supported by a grant from Deutsche Forschungsgemeinschaft (NI 708/2-1), by the German Federal Ministry of Education and Research (BMBF) within the ,"Distributed Fading Memory for Stimulus Properties in the Primary Visual Cortex",1,216593,NA,NA,NA,"2009-12-22","Distributed Fading Memory for Stimulus Properties in the Primary Visual Cortex",0,12,3,7,5,0,0,0,0,0,0,2,5139,939,40,6118,298,106,404,66,4,70,1,1,0,0,0,0,0,0
"10.1371/journal.pbio.1000272","PLoS Biology","22/12/2009","Research Article","This work was supported by the Medical Research Council Career Development Award (Agreement ID: 78415, File Number: G0600062), EC FP7 Collaborative Project 223601 ,"Transglutaminase-Mediated Semen Coagulation Controls Sperm Storage in the Malaria Mosquito",1,223601,NA,NA,NA,"2009-12-22","Transglutaminase-Mediated Semen Coagulation Controls Sperm Storage in the Malaria Mosquito",0,1,13,18,12,0,0,0,0,2,0,0,3801,756,35,4592,467,223,690,14,2,16,0,0,0,0,0,0,0,0
"10.1371/journal.pbio.1000352","PLoS Biology","13/04/2010","Research Article","This work was supported by grants from the European Community 7th Framework Program (NeuroGlia, HEALTH-F2-2007-202167), Telethon Italy (GGP07278), and CARIPARO foundation. MGG was also supported by the MEC (Spain). The funders had no role in study design, data collection and analysis, decision to publish, or preparation of the manuscript.","An Excitatory Loop with Astrocytes Contributes to Drive Neurons to Seizure Threshold",1,202167,NA,NA,NA,"2010-04-13","An Excitatory Loop with Astrocytes Contributes to Drive Neurons to Seizure Threshold",0,4,17,32,15,0,0,0,0,0,0,0,3697,1214,70,4981,1019,647,1666,36,5,41,0,0,0,0,0,0,0,0
"10.1371/journal.pbio.1000384","PLoS Biology","11/05/2010","Research Article","This work was supported by FP6 Marie Curie Excellence grant Trans-Tar to GN (MEXT-CT-2006-042393); FP7 Collaborative Project Model-In to GN and JR (grant #222008); and Italian Association for Research on Cancer (AIRC). JR received support from the Wellcome Trust through grant 075491/Z/04. The funders had no role in study design, data collection and analysis, decision to publish, or preparation of the manuscript.","A Large Fraction of Extragenic RNA Pol II Transcription Sites Overlap Enhancers",1,222008,NA,NA,NA,"2010-05-11","A Large Fraction of Extragenic RNA Pol II Transcription Sites Overlap Enhancers",0,11,49,66,32,0,0,0,0,2,0,0,6672,2130,49,8851,954,544,1498,0,0,0,0,0,0,0,0,0,0,0
"10.1371/journal.pbio.1000434","PLoS Biology","20/07/2010","Research Article","This work was supported by grants from the Centre National de la Recherche Scientifique (UPR 9022 du CNRS), the Institut National de la Sant,"The Major Yolk Protein Vitellogenin Interferes with the Anti-<i>Plasmodium</i> Response in the Malaria Mosquito <i>Anopheles gambiae</i>",1,242095,228421,223601,NA,"2010-07-20","The Major Yolk Protein Vitellogenin Interferes with the Anti-<italic>Plasmodium</italic> Response in the Malaria Mosquito <italic>Anopheles gambiae</italic>",0,0,9,14,6,0,0,0,0,0,0,0,2926,787,39,3752,356,221,577,23,4,27,0,0,0,0,0,0,0,0
"10.1371/journal.pbio.1000475","PLoS Biology","07/09/2010","Research Article","Funding for sequencing was supported by Roche Applied Science, the University of Minnesota (College of Veterinary Medicine, and College of Food, Agricultural & Natural Resource Sciences), the Utah State University (Center for Integrated Biosystems), the Virginia Bioinformatics Institute Core Lab Facility, Virginia Tech University (College of Agriculture & Life Sciences, Virginia Bioinformatics Institute, Fralin Biotechnology Center, Office of Vice President for Research), the Intramural Research Programs of the USDA Agricultural Research Service and the NIH National Institute on Aging, and Multi-State Research Support Program (USDA-NIFA-NRSP8). Funding for assembly, annotation and genomic analyses was provided by The Center for Genomics regulation and the European Community (Barcelona, Spain), ,"Multi-Platform Next-Generation Sequencing of the Domestic Turkey (<i>Meleagris gallopavo</i>): Genome Assembly and Analysis",1,222664,NA,NA,NA,"2010-09-07","Multi-Platform Next-Generation Sequencing of the Domestic Turkey (<italic>Meleagris gallopavo</italic>): Genome Assembly and Analysis",0,14,49,73,21,0,0,0,0,18,0,3,12177,2541,76,14794,1423,593,2016,85,4,89,0,0,0,0,0,0,0,0
"10.1371/journal.pbio.1000492","PLoS Biology","28/09/2010","Research Article","This work was supported by the Giovanni Armenise-Harvard Foundation: Career Development Award (AB); European Commission: Marie Curie International Reintegration Grant (AB); European Research Council (ERC) under the European Community's 7th Framework Programmme (FP7/2007,"Desynchronization of Neocortical Networks by Asynchronous Release of GABA at Autaptic and Synaptic Contacts from Fast-Spiking Interneurons",1,200808,NA,NA,NA,"2010-09-28","Desynchronization of Neocortical Networks by Asynchronous Release of GABA at Autaptic and Synaptic Contacts from Fast-Spiking Interneurons",0,3,3,9,1,0,0,0,0,0,0,0,1953,658,66,2677,338,177,515,0,0,0,0,0,0,0,0,0,0,0
"10.1371/journal.pbio.1000530","PLoS Biology","26/10/2010","Research Article","This work was supported by Medical Research Council (MRC, www.mrc.ac.uk), European Research Council (ERC, erc.europa.eu, 206726-CLIP), Human Frontier Science Program (HFSP, www.hfsp.org, RGP0024/2008-C), and Slovenian Research Agency (P2-0209, J2-2197, L2-1112, Z7-3665). The funders had no role in study design, data collection and analysis, decision to publish, or preparation of the manuscript.","iCLIP Predicts the Dual Splicing Effects of TIA-RNA Interactions",1,206726,NA,NA,NA,"2010-10-26","iCLIP Predicts the Dual Splicing Effects of TIA-RNA Interactions",0,4,16,5,8,0,0,0,0,0,0,0,3294,834,55,4183,574,381,955,49,5,54,0,0,0,0,0,0,0,0
"10.1371/journal.pbio.1000569","PLoS Biology","04/01/2011","Research Article","ZA, HGS, KK, HvB, and AS are supported by GENCODYS, a large-scale integrating project funded by the European Union under the 7th Framework Programme (241995). HM and HGS are supported by HEROIC, an integrating project funded by the European Union under the 6th Framework Programme (LSHG-CT-2005-018883). ZA is supported by an Hungarian Governmental grant (T,"Epigenetic Regulation of Learning and Memory by <i>Drosophila</i> EHMT/G9a",1,241995,NA,NA,NA,"2011-01-04","Epigenetic Regulation of Learning and Memory by <italic>Drosophila</italic> EHMT/G9a",0,6,12,12,5,0,0,0,0,2,1,0,6249,1796,69,8114,1163,645,1808,58,4,62,0,0,0,0,0,0,0,0
"10.1371/journal.pbio.1000577","PLoS Biology","18/01/2011","Research Article","This work was funded by EU project PITN-GA-2009-238017 HARVEST; EU project 245070 FP7-KBBE-2009-3 SUNBIOPATH; FONDAZIONE CARIVERONA 2009; and Chemical Sciences, Geosciences and Biosciences Division, Office of Basic Energy Sciences, Office of Science, US Department of Energy (FWP number 449B); the Director, Office of Science, Office of Basic Energy Sciences, of the U.S. Department of Energy under Contract DE-AC02-05CH11231 and the Division of Chemical Sciences, Geosciences, and Biosciences, Office of Basic Energy Sciences of the U.S. Department of Energy through Grant DE-AC03-76SF000098. The funders had no role in study design, data collection and analysis, decision to publish, or preparation of the manuscript.","Analysis of LhcSR3, a Protein Essential for Feedback De-Excitation in the Green Alga <i>Chlamydomonas reinhardtii</i>",1,238017,245070,NA,NA,"2011-01-18","Analysis of LhcSR3, a Protein Essential for Feedback De-Excitation in the Green Alga <italic>Chlamydomonas reinhardtii</italic>",0,2,11,14,3,0,0,0,0,0,0,0,2505,816,62,3383,343,201,544,0,0,0,0,0,0,0,0,0,0,0
"10.1371/journal.pbio.1000623","PLoS Biology","07/06/2011","Research Article","This work was supported by the EU-funded projects ETHERPATHS (FP7-KBBE-222639, http://www.etherpaths.org/) and HEPADIP (FP6-LSHM-CT-2005-018734, http://www.hepadip.org/), the Centre of Excellence in Computational Nanoscience grant by the Academy of Finland, Helsinki University Central Hospital grants, the Centre of Excellence in Complex Disease Genetics grant by the Academy of Finland, and KHP by Jalmari and Rauha Ahokas, Yrj,"Association of Lipidome Remodeling in the Adipocyte Membrane with Acquired Obesity in Humans",1,222639,NA,NA,NA,"2011-06-07","Association of Lipidome Remodeling in the Adipocyte Membrane with\n                    Acquired Obesity in Humans",0,1,12,15,3,0,0,0,0,11,0,0,4445,1156,76,5677,543,307,850,32,3,35,0,0,0,0,0,0,0,0
"10.1371/journal.pbio.1001034","PLoS Biology","29/03/2011","Research Article","This research was supported by the following grants: EU FP7 2020288 NeuroCypres to CU, ABS, VT (http://www.neurocypres.eu). RFBR and MCB RAS grants to VT (http://www.rfbr.ru and http://www.ras.ru/presidium/documents/directions.aspx?ID=727c26ac-2098-445a-a7ab-344b5bb71165). NIEHS/NIH Intramural Research Program to JY. KULeuven Onderzoekstoelage OT/08/048 to CU. The funders had no role in study design, data collection and analysis, decision to publish, or preparation of the manuscript.","A Structural and Mutagenic Blueprint for Molecular Recognition of Strychnine and <i>d</i>-Tubocurarine by Different Cys-Loop Receptors",1,202088,NA,NA,NA,"2011-03-29","A Structural and Mutagenic Blueprint for Molecular Recognition of Strychnine and <italic>d</italic>-Tubocurarine by Different Cys-Loop Receptors",0,3,12,11,3,0,0,0,0,2,0,0,2311,493,46,2850,430,144,574,14,0,14,0,0,0,0,1,5,0,0
"10.1371/journal.pbio.1001086","PLoS Biology","28/06/2011","Research Article","This work was supported by grants from the European Union FP 7 (Model-in, 222008) (JR, NF, MEB, AA), the Italian Association for Cancer Research and Cariplo Foundation (MEB, TB), Wellcome Trust (grant 075491/Z/04, JR, DB), Progetti di Rilevante Interesse Nazionale (GC, MEB), the Giovanni Armenise-Harvard Foundation Career Development Program and the Association of International Cancer Research (TB), Istituto Pasteur-Fondazione Cenci Bolognetti Universita' di Roma La Sapienza (GC). The funders had no role in study design, data collection and analysis, decision to publish, or preparation of the manuscript.","Substantial Histone Reduction Modulates Genomewide Nucleosomal Occupancy and Global Transcriptional Output",1,222008,NA,NA,NA,"2011-06-28","Substantial Histone Reduction Modulates Genomewide Nucleosomal Occupancy and Global Transcriptional Output",0,2,9,9,6,0,0,0,0,7,0,0,3281,826,57,4164,442,226,668,32,1,33,0,0,0,0,0,0,0,0
"10.1371/journal.pbio.1001094","PLoS Biology","05/07/2011","Research Article","The authors thank European Research Council Advanced Investigator grant 233376 (ALBUGON), Gatsby Foundation, BBSRC, DFG (KE 1509/1-1), DASTI (Danish Agency for Science, Technology and Innovation) for funding. The funders had no role in study design, data collection and analysis, decision to publish, or preparation of the manuscript.","Gene Gain and Loss during Evolution of Obligate Parasitism in the White Rust Pathogen of <i>Arabidopsis thaliana</i>",1,233376,NA,NA,NA,"2011-07-05","Gene Gain and Loss during Evolution of Obligate Parasitism in the White Rust Pathogen of <italic>Arabidopsis thaliana</italic>",0,0,19,19,7,0,0,0,0,0,1,1,4282,1161,65,5508,403,200,603,44,1,45,0,0,0,0,0,0,0,0
"10.1371/journal.pbio.1001107","PLoS Biology","19/07/2011","Research Article","This work was supported by European Commission FP7 Grant RETICIRC HEALTH-F2-2009-223156 (coordinator: MK) to MK and Dr. R. Weiler. The tilling mutant was generated via a NWO grant to Drs F. van Eeden, R. Plasterk, and D. Zivkovic and a grant by the European Commission LSHG-CT-2003-503496. MK was supported by ALW-NWO, FOM. and ZonMW-NWO. CRS was supported by NWO VENI #916.66.079. GZ was supported in part by SFB 509 ,"Synaptic Transmission from Horizontal Cells to Cones Is Impaired by Loss of Connexin Hemichannels",1,223156,NA,NA,NA,"2011-07-19","Synaptic Transmission from Horizontal Cells to Cones Is Impaired by Loss of Connexin Hemichannels",0,0,10,7,0,0,0,0,0,0,0,0,1699,397,46,2142,306,163,469,17,0,17,0,0,0,0,0,0,0,0
"10.1371/journal.pbio.1001122","PLoS Biology","09/08/2011","Research Article","JK is supported by NIH NIGMS award K25GM085806, KF is supported by European Research Council Grant 242670, and AM is supported by NIGMS Center for Systems Biology (GM068763). The funders had no role in study design, data collection and analysis, decision to publish, or preparation of the manuscript.","Sucrose Utilization in Budding Yeast as a Model for the Origin of Undifferentiated Multicellularity",1,242670,NA,NA,NA,"2011-08-09","Sucrose Utilization in Budding Yeast as a Model for the Origin of Undifferentiated Multicellularity",0,8,7,7,3,2,0,0,0,22,0,0,7962,1613,82,9657,301,146,447,95,3,98,0,0,0,0,0,0,0,0
"10.1371/journal.pbio.1001161","PLoS Biology","27/09/2011","Research Article","GRL acknowledges support from the Human Frontier Science Program (grant RGY0067/2008, http://www.hfsp.org/). MFC acknowledges support from ANR-PCV program 2006 (http://www.agence-nationale-recherche.fr/Accueil), the Ligue Nationale contre le Cancer (,"Individual Actin Filaments in a Microfluidic Flow Reveal the Mechanism of ATP Hydrolysis and Give Insight Into the Properties of Profilin",1,249982,NA,NA,NA,"2011-09-27","Individual Actin Filaments in a Microfluidic Flow Reveal the Mechanism of ATP Hydrolysis and Give Insight Into the Properties of Profilin",0,0,4,5,2,0,0,0,0,0,0,0,2502,600,48,3150,213,135,348,18,1,19,0,0,0,0,0,0,0,0
"10.1371/journal.pbio.1001188","PLoS Biology","01/11/2011","Research Article","European Community's Seventh Framework Programme (FP7/ 2007-2013) under the grant CISSTEM, DFG-SFB488. The funders had no role in study design, data collection and analysis, decision to publish, or preparation of the manuscript.","De Novo Genesis of Enhancers in Vertebrates",1,223210,NA,NA,NA,"2011-11-01","De Novo Genesis of Enhancers in Vertebrates",0,16,3,5,1,0,0,0,0,13,0,0,5484,1138,84,6706,154,97,251,0,0,0,1,0,0,0,0,0,0,0
"10.1371/journal.pbio.1001199","PLoS Biology","15/11/2011","Research Article","This work was funded by the Spanish Ministries of Health, and Science ane Innovation (CB07/02/2005; FIS 08/1120, 08/1359, 08/1635, and 09/02483; RTICCC RD06/0020/1060 and RD06/0020/0028; Transversal Action Against Cancer; the Spanish Biomedical Research Centre Networks for Epidemiology and Public Health, and Rare Diseases; and the ,"Interplay between BRCA1 and RHAMM Regulates Epithelial Apicobasal Polarization and May Influence Risk of Breast Cancer",1,223175,NA,NA,NA,"2011-11-15","Interplay between BRCA1 and RHAMM Regulates Epithelial Apicobasal Polarization and May Influence Risk of Breast Cancer",0,1,1,2,1,0,0,0,0,1,0,0,3669,878,49,4596,759,494,1253,16,0,16,0,0,0,0,0,0,0,0
"10.1371/journal.pbio.1001203","PLoS Biology","22/11/2011","Research Article","This work was supported by the Netherlands Organisation for Scientific Research (NWO-VENI awarded to FdL; NWO-Rubicon awarded to SvG) and by an ERC Advanced Investigator Grant (230355) to VAFL. The funders had no role in study design, data collection and analysis, decision to publish, or preparation of the manuscript.","How Awareness Changes the Relative Weights of Evidence During Human Decision-Making",1,230355,NA,NA,NA,"2011-11-22","How Awareness Changes the Relative Weights of Evidence During Human Decision-Making",0,6,1,1,1,0,0,0,0,8,0,0,4502,906,86,5494,484,114,598,68,3,71,0,0,0,0,0,0,0,0
"10.1371/journal.pbio.1001259","PLoS Biology","14/02/2012","Research Article","Supported by grants from Ministerio de Ciencia e Innovaci,"Astrocytes Mediate In Vivo Cholinergic-Induced Synaptic Plasticity",1,202167,253635,NA,NA,"2012-02-14","Astrocytes Mediate In Vivo Cholinergic-Induced Synaptic Plasticity",0,1,7,8,5,0,0,0,0,8,1,0,4453,1360,70,5883,489,385,874,0,0,0,0,0,0,0,0,0,0,0
"10.1371/journal.pbio.1001261","PLoS Biology","14/02/2012","Research Article","The work has been supported by the grant PITN-GA2009-238423 from the European Commission to M.W. and M.R., and by grants Wi1058/8-1 (FOR 1352) and RI 990/4-1(FOR1352) from the Deutsche Forschungsgemeinschaft to M.W. and M.R., respectively. F. Berkemeier has been supported by Elitenetzwerk Bayern. The funders had no role in study design, data collection and analysis, decision to publish, or preparation of the manuscript.","Superhelical Architecture of the Myosin Filament-Linking Protein Myomesin with Unusual Elastic Properties",1,238423,NA,NA,NA,"2012-02-14","Superhelical Architecture of the Myosin Filament-Linking Protein Myomesin with Unusual Elastic Properties",0,1,1,2,0,0,0,0,0,0,0,21,2377,445,51,2873,168,86,254,6,0,6,0,0,0,0,0,0,0,0
"10.1371/journal.pbio.1001262","PLoS Biology","21/02/2012","Research Article","This work was supported by grants from the Spanish Ministry of Science and Innovation (SAF-2008-04616, SAF-2009-05558-E, CSD-2010-00045, and SAF-2011-24730 to J.A.E; SAF2010-15676 to S.K.; SAF-2009-09129 to C.V.; PI-08/1067 to J.M.S.; SAF-2009-09394 to J.D.F.). In addition, the laboratory of J.A.E. is funded from Fundaci,"Facilitation of AMPA Receptor Synaptic Delivery as a Molecular Mechanism for Cognitive Enhancement",1,201600,NA,NA,NA,"2012-02-21","Facilitation of AMPA Receptor Synaptic Delivery as a Molecular Mechanism for Cognitive Enhancement",0,0,2,1,0,0,0,0,0,12,0,0,4266,1058,61,5385,472,335,807,32,0,32,0,0,0,0,0,0,0,0
"10.1371/journal.pbio.1001293","PLoS Biology","27/03/2012","Research Article","Funders: 1. European Research council Advanced Research Grant to EK: ERC-2009-AdG #250106. 2. Bettencourt-Schueller Foundation. Research Prize to EK. The funders had no role in study design, data collection and analysis, decision to publish, or preparation of the manuscript.","Reasoning, Learning, and Creativity: Frontal Lobe Function and Human Decision-Making",1,250106,NA,NA,NA,"2012-03-27","Reasoning, Learning, and Creativity: Frontal Lobe Function and Human Decision-Making",0,4,1,2,0,0,0,0,0,25,0,0,6760,1169,82,8011,364,145,509,47,2,49,0,0,0,0,0,0,0,0
"10.1371/journal.pbio.1001297","PLoS Biology","03/04/2012","Primer","SB is funded by the EU FP7 grant ,"Immunity in Society: Diverse Solutions to Common Problems",1,242131,NA,NA,NA,"2012-04-03","Immunity in Society: Diverse Solutions to Common Problems",0,0,0,0,0,0,0,0,0,3,2,0,2887,617,55,3559,149,70,219,16,1,17,0,0,0,0,0,0,0,0
"10.1371/journal.pbio.1001298","PLoS Biology","03/04/2012","Research Article","This work was supported by the Spanish Ministerio de Ciencia e Innovaci,"Cytoneme-Mediated Delivery of Hedgehog Regulates the Expression of Bone Morphogenetic Proteins to Maintain Germline Stem Cells in <i>Drosophila</i>",1,238186,NA,NA,NA,"2012-04-03","Cytoneme-Mediated Delivery of Hedgehog Regulates the Expression of Bone Morphogenetic Proteins to Maintain Germline Stem Cells in <italic>Drosophila</italic>",0,0,0,0,0,0,0,0,0,1,0,1,2426,563,38,3027,248,151,399,4,0,4,1,0,0,0,0,0,0,0
"10.1371/journal.pbio.1001300","PLoS Biology","03/04/2012","Research Article","Funding for this project was obtained by the German Research Foundation DFG (http://www.dfg.de/en/index.jsp) as an Individual Research Grant (CR118/2-1 to SC) and the European Research Council (http://erc.europa.eu/) in form of two ERC Starting Grants (ERC-2009-StG240371-SocialVaccines to SC and ERC-2010-StG259294-LatentCauses to FJT). In addition, the Junge Akademie (Young Academy of the Berlin-Brandenburg Academy of Sciences and Humanities and the National Academy of Sciences Leopoldina (http://www.diejungeakademie.de/english/index.html) funded this joint Antnet project of SC and FJT. The funders had no role in study design, data collection and analysis, decision to publish, or preparation of the manuscript.","Social Transfer of Pathogenic Fungus Promotes Active Immunisation in Ant Colonies",1,259294,NA,NA,NA,"2012-04-03","Social Transfer of Pathogenic Fungus Promotes Active Immunisation in Ant Colonies",0,0,2,1,0,0,0,0,0,29,0,1,6053,1239,41,7333,115,65,180,50,0,50,0,0,0,0,0,0,0,0
"10.1371/journal.pbio.1001329","PLoS Biology","22/05/2012","Research Article","The Robotic set-up was purchased through the generous support of the Israeli Science Foundation (ISF) Legacy Heritage fund (grant # 1995/08), a career development award from the Human Frontiers Science Program (HFSP) (CDA0006/2008-C), and a generous donation by Mr. James Nathan, Beverly Hills, California, US and the Estate of Lela London. YH was supported by the above grant from the ISF. YE is supported in part by a WIS Deans' grant. YE and MS are supported by an ERC StG (grant # 260395). HJS and SM were supported by the UK Medical Research Council (MRC file reference number U105178783). The funders had no role in study design, data collection and analysis, decision to publish, or preparation of the manuscript.","A Systematic Approach to Pair Secretory Cargo Receptors with Their Cargo Suggests a Mechanism for Cargo Selection by Erv14",1,260395,NA,NA,NA,"2012-05-22","A Systematic Approach to Pair Secretory Cargo Receptors with Their Cargo Suggests a Mechanism for Cargo Selection by Erv14",0,1,0,0,0,0,0,0,0,0,8,0,2398,425,61,2884,157,75,232,0,0,0,0,0,0,0,0,0,0,0
"10.1371/journal.pcbi.1000180","PLoS Computational Biology","10/10/2008","Research Article","Written under partial support by the Austrian Science Fund FWF, project # P17229-N04, project # S9102-N04, as well as project # FP6-015879 (FACETS) and project # FP7-216886 (PASCAL2) of the European Union.","A Learning Theory for Reward-Modulated Spike-Timing-Dependent Plasticity with Application to Biofeedback",1,216886,NA,NA,NA,"2008-10-10","A Learning Theory for Reward-Modulated Spike-Timing-Dependent\n                    Plasticity with Application to Biofeedback",0,6,18,34,11,0,0,0,0,1,0,0,3096,932,35,4063,768,374,1142,115,7,122,0,0,0,0,0,0,0,0
