"doi","journal","publication_date.x","article_type","financial_disclosure","title_display","score","grantID1","grantID2","grantID3","grantID4","publication_date.y","title","biod","citeulike","crossref","scopus","pubmed","researchblogging","nature","bloglines","postgenomic","facebook","twitter","wikipedia","counter_html","counter_pdf","counter_xml","counter","pmc_html","pmc_pdf","pmc","mendeley_readers","mendeley_groups","mendeley","comments","comment_replies","notes","note_replies","ratings","avg_rating","rating_comments","trackbacks"
"10.1371/journal.pone.0031937","PLoS ONE","16/02/2012","Research Article","This work was supported by the FP6 funded TREAT-NMD network of excellence (LSHM-CT-2006-036825), the FP7 BIO-NMD project (FP7-HEALTH-241665), the Dutch organization for scientific research (NWO/ZonMW, 95100102), and the Dutch Duchenne Parent Project (www.duchenne.nl) and utilizes the infrastructure of the Center for Biomedical Genetics (the Netherlands) and the Center for Medical Systems Biology (the Netherlands). The funders had no role in study design, data collection and analysis, decision to publish, or preparation of the manuscript.","The Effects of Low Levels of Dystrophin on Mouse Muscle Function and Pathology",1,241665,NA,NA,NA,"2012-02-16","The Effects of Low Levels of Dystrophin on Mouse Muscle Function and Pathology",0,0,2,1,1,0,0,0,0,0,0,0,835,298,35,1168,554,255,809,4,0,4,0,0,0,0,0,0,0,0
"10.1371/journal.pone.0031950","PLoS ONE","22/02/2012","Research Article","This research was financed by the Funda,"Functional Desaturase <i>Fads1</i> (<i>,1,276916,NA,NA,NA,"2012-02-22","Functional Desaturase Fads1 (?5) and Fads2 (?6) Orthologues Evolved before the Origin of Jawed Vertebrates",71,0,1,1,0,0,0,0,0,0,0,0,667,177,36,880,160,82,242,5,0,5,0,0,0,0,0,0,0,0
"10.1371/journal.pone.0032034","PLoS ONE","22/02/2012","Research Article","This work was funded by the following sources: Science Foundation Ireland (www.sfi.ie) Investigator grants (Nos: SFI/01/F.1/B028 and SFI/08/IN.1/B2038); Department of Agriculture, Fisheries and Food (www.agriculture.ie) Research Stimulus Grant (No: RSF 06 405); European Union Framework 7 (http://cordis.europa.eu/fp7) Project Grant (No: KBBE-211602-MACROSYS); Irish Research Council for Science, Engineering and Technology (IRCSET) funded Bioinformatics and Systems Biology PhD Programme (http://bioinfo-casl.ucd.ie/PhD). The funders had no role in study design, data collection and analysis, decision to publish, or preparation of the manuscript.","Global Gene Expression and Systems Biology Analysis of Bovine Monocyte-Derived Macrophages in Response to <i>In Vitro</i> Challenge with <i>Mycobacterium bovis</i>",1,211602,NA,NA,NA,"2012-02-22","Global Gene Expression and Systems Biology Analysis of Bovine Monocyte-Derived Macrophages in Response to <italic>In Vitro</italic> Challenge with <italic>Mycobacterium bovis</italic>",0,0,0,1,1,0,0,0,0,0,0,0,886,299,33,1218,347,171,518,6,0,6,0,0,1,0,0,0,0,0
"10.1371/journal.pone.0032107","PLoS ONE","09/03/2012","Research Article","This work was funded by The Network of Animal Disease Infectiology Research Facilities (NADIR), project 228394 (INFRA 2008), seventh framework programme. Dr. Bertran has an FPU Pre-Doctoral grant from the Ministry of Education of Spain. The funders had no role in study design, data collection and analysis, decision to publish, or preparation of the manuscript.","Highly (H5N1) and Low (H7N2) Pathogenic Avian Influenza Virus Infection in Falcons Via Nasochoanal Route and Ingestion of Experimentally Infected Prey",1,228394,NA,NA,NA,"2012-03-09","Highly (H5N1) and Low (H7N2) Pathogenic Avian Influenza Virus Infection in Falcons Via Nasochoanal Route and Ingestion of Experimentally Infected Prey",0,0,0,0,0,0,0,0,0,0,0,0,597,166,40,803,189,85,274,4,0,4,0,0,0,0,0,0,0,0
"10.1371/journal.pone.0032121","PLoS ONE","01/03/2012","Research Article","This work was supported by European Research Council grant #230313 awarded to JG. The funders had no role in study design, data collection and analysis, decision to publish, or preparation of the manuscript.","Deciphering CAPTCHAs: What a Turing Test Reveals about Human Cognition",1,230313,NA,NA,NA,"2012-03-01","Deciphering CAPTCHAs: What a Turing Test Reveals about Human Cognition",0,0,0,0,0,0,0,0,0,2,0,0,1384,165,50,1599,106,17,123,2,0,2,0,0,0,0,0,0,0,0
"10.1371/journal.pone.0032125","PLoS ONE","29/02/2012","Research Article","This work was supported by grant FP7 (HEALTH-F3-2008-200732) from the European Commission. The funders had no role in study design, data collection and analysis, decision to publish, or preparation of the manuscript.","The Role of Alveolar Epithelial Cells in Initiating and Shaping Pulmonary Immune Responses: Communication between Innate and Adaptive Immune Systems",1,200732,NA,NA,NA,"2012-02-29","The Role of Alveolar Epithelial Cells in Initiating and Shaping Pulmonary Immune Responses: Communication between Innate and Adaptive Immune Systems",0,0,0,1,1,0,0,0,0,0,0,0,839,269,34,1142,279,197,476,7,0,7,0,0,0,0,0,0,0,0
"10.1371/journal.pone.0032200","PLoS ONE","05/03/2012","Research Article","This work was supported by the European Union's Seventh Framework Programme (FP7/2007-2013) for the Innovative Medicine Initiative under grant agreement n. IMI/115006 (the SUMMIT consortium); ATENEO 2009/2010 ,"Effect of Size and Heterogeneity of Samples on Biomarker Discovery: Synthetic and Real Data Assessment",1,223378,NA,NA,NA,"2012-03-05","Effect of Size and Heterogeneity of Samples on Biomarker Discovery: Synthetic and Real Data Assessment",0,1,0,1,1,0,0,0,0,1,1,0,701,144,42,887,123,57,180,4,0,4,0,0,0,0,0,0,0,0
"10.1371/journal.pone.0032213","PLoS ONE","24/02/2012","Research Article","This work was funded by and carried out as a part of two related projects supported by the European Union: Hepadip (Hepatic and Adipose Tissue and Functions in the Metabolic Syndrome) under the 6th Framework Program (contract LSHM-CT-2005-018734) and Flip (fatty liver inhibition of progression) under the Seventh Framework Programme (FP7/2007-2013, grant agreement n,"Waist Circumference Adjusted for Body Mass Index and Intra-Abdominal Fat Mass",1,241762,NA,NA,NA,"2012-02-24","Waist Circumference Adjusted for Body Mass Index and Intra-Abdominal Fat Mass",0,1,1,0,0,0,0,0,0,0,0,0,904,207,39,1150,446,237,683,0,0,0,0,0,0,0,0,0,0,0
"10.1371/journal.pone.0032266","PLoS ONE","20/03/2012","Research Article","The work described herein was supported by Enterprise Ireland under Grant Number CC20080001. JFC and TGD are also supported in part by Science Foundation Ireland (SFI) in the form of a centre grant (Alimentary Pharmabiotic Centre) through the Irish Government's National Development Plan. The authors and their work were supported by SFI (grant no.s 02/CE/B124 and 07/CE/B1368). JFC is funded by European Community's Seventh Framework Programme; Grant Number: FP7/2007,"Dynamic 5-HT<sub>2C</sub> Receptor Editing in a Mouse Model of Obesity",1,201714,NA,NA,NA,"2012-03-20","Dynamic 5-HT<sub>2C</sub> Receptor Editing in a Mouse Model of Obesity",0,0,0,0,0,0,0,0,0,0,0,0,679,233,38,950,293,153,446,5,0,5,0,0,0,0,0,0,0,0
"10.1371/journal.pone.0032301","PLoS ONE","27/02/2012","Research Article","The work of MPCC was supported by Institut National de la Recherche Agronomique (INRA) (Jeune Equipe grant). KR was the recipient of a fellowship from INRA. KR's PhD project received financial support as an associated project from the Marie Curie FP7 Initial Training Network Cross Talk (grant agreement n,"Analysis of the Peptidoglycan Hydrolase Complement of <i>Lactobacillus casei</i> and Characterization of the Major ,1,215553,NA,NA,NA,"2012-02-27","Analysis of the Peptidoglycan Hydrolase Complement of <italic>Lactobacillus casei</italic> and Characterization of the Major ?-D-Glutamyl-L-Lysyl-Endopeptidase",0,0,0,0,0,0,0,0,0,0,0,0,576,209,36,821,259,153,412,3,1,4,0,0,0,0,0,0,0,0
"10.1371/journal.pone.0032306","PLoS ONE","27/02/2012","Research Article","This project was funded by European Community Sixth Framework Program (LSHM-CT- 2007-037273), the Swedish Research Council (8691), the Knut and Alice Wallenberg Foundation (http://www.wallenberg.com/kaw/in_english/), the Swedish Heart-Lung Foundation, the Torsten and Ragnar S,"Combined Chromatin and Expression Analysis Reveals Specific Regulatory Mechanisms within Cytokine Genes in the Macrophage Early Immune Response",1,221346,NA,NA,NA,"2012-02-27","Combined Chromatin and Expression Analysis Reveals Specific Regulatory Mechanisms within Cytokine Genes in the Macrophage Early Immune Response",0,3,0,2,2,0,0,0,0,0,0,0,782,289,34,1105,278,152,430,14,1,15,0,0,0,0,0,0,0,0
"10.1371/journal.pone.0032316","PLoS ONE","13/04/2012","Research Article","This research has been supported by grants from the Netherlands Organisation for Scientific Research (NWO 51.02.060, NWO 480-04-004), the High Potential Grant University Utrecht, Hersenstichting Nederland (2010(1)-79) and European Research Council (ERC-230374). The funders had no role in study design, data collection and analysis, decision to publish, or preparation of the manuscript.","White Matter Development in Early Puberty: A Longitudinal Volumetric and Diffusion Tensor Imaging Twin Study",1,230374,NA,NA,NA,"2012-04-13","White Matter Development in Early Puberty: A Longitudinal Volumetric and Diffusion Tensor Imaging Twin Study",0,0,1,0,0,0,0,0,0,0,0,0,711,171,25,907,136,61,197,9,2,11,0,0,0,0,0,0,0,0
"10.1371/journal.pone.0032327","PLoS ONE","05/03/2012","Research Article","The STANISLAS Family Study was supported by the ,"A Genome-Wide Association Study Identifies rs2000999 as a Strong Genetic Determinant of Circulating Haptoglobin Levels",1,201413,NA,NA,NA,"2012-03-05","A Genome-Wide Association Study Identifies rs2000999 as a Strong Genetic Determinant of Circulating Haptoglobin Levels",0,0,1,1,0,0,0,0,0,0,0,0,786,217,46,1049,295,176,471,4,1,5,0,0,0,0,0,0,0,0
"10.1371/journal.pone.0032330","PLoS ONE","06/03/2012","Research Article","The work was supported by grants from the Foundation Fighting Blindness (FFB, Owings Mills, MD, USA), Moorfields Special Trustees, Fight for Sight, European Union (AAVEYE) and the National Institute for Health Research UK to the Biomedical Research Centre for Ophthalmology based at Moorfields Eye Hospital National Health Service Foundation Trust and University College London Institute of Ophthalmology (London, UK). MHT was supported by a Medical Research Council Clinical Training Fellowship. MM is supported by an FFB Career Development Award. The funders had no role in study design, data collection and analysis, decision to publish, or preparation of the manuscript.","Leber Congenital Amaurosis Associated with <i>AIPL1</i>: Challenges in Ascribing Disease Causation, Clinical Findings, and Implications for Gene Therapy",1,223445,NA,NA,NA,"2012-03-06","Leber Congenital Amaurosis Associated with <italic>AIPL1</italic>: Challenges in Ascribing Disease Causation, Clinical Findings, and Implications for Gene Therapy",0,0,0,0,0,0,0,0,0,0,0,0,634,158,43,835,296,148,444,0,0,0,0,0,0,0,0,0,0,0
"10.1371/journal.pone.0032336","PLoS ONE","29/02/2012","Research Article","This work was supported by grants from the Academy of Finland, the Sigrid Jus,"Myelin 2,1,226716,NA,NA,NA,"2012-02-29","Myelin 2?,3?-Cyclic Nucleotide 3?-Phosphodiesterase: Active-Site Ligand Binding and Molecular Conformation",0,0,1,2,0,0,0,0,0,0,0,0,473,126,33,632,137,73,210,4,1,5,0,0,0,0,0,0,0,0
"10.1371/journal.pone.0032369","PLoS ONE","06/03/2012","Research Article","The research leading to these results has received funding from the European Union Seventh Framework Programme (FP7/2007,"Differences in HIV Natural History among African and Non-African Seroconverters in Europe and Seroconverters in Sub-Saharan Africa",1,260694,NA,NA,NA,"2012-03-06","Differences in HIV Natural History among African and Non-African Seroconverters in Europe and Seroconverters in Sub-Saharan Africa",0,0,0,0,0,0,0,0,0,2,0,0,769,198,40,1007,195,92,287,2,0,2,0,0,0,0,0,0,0,0
"10.1371/journal.pone.0032381","PLoS ONE","22/02/2012","Research Article","The research leading to these results received funding from the UK Medical Research Council (Grant G0601176) and the European Community's Seventh Framework Programmes ,"Spores of <i>Clostridium difficile</i> Clinical Isolates Display a Diverse Germination Response to Bile Salts",1,223585,237942,NA,NA,"2012-02-22","Spores of <italic>Clostridium difficile</italic> Clinical Isolates Display a Diverse Germination Response to Bile Salts",0,0,1,1,0,0,0,0,0,0,0,0,825,279,34,1138,411,268,679,5,0,5,1,1,0,0,0,0,0,0
"10.1371/journal.pone.0032440","PLoS ONE","05/03/2012","Research Article","This work was supported by the Fondation pour la Recherche M,"Bone Marrow p16<sup>INK4a</sup>-Deficiency Does Not Modulate Obesity, Glucose Homeostasis or Atherosclerosis Development",1,235221,NA,NA,NA,"2012-03-05","Bone Marrow p16<sup>INK4a</sup>-Deficiency Does Not Modulate Obesity, Glucose Homeostasis or Atherosclerosis Development",0,0,1,1,0,0,0,0,0,0,0,0,483,169,42,694,192,87,279,3,0,3,0,0,0,0,0,0,0,0
"10.1371/journal.pone.0032458","PLoS ONE","27/06/2012","Research Article","This work was supported by: La Ligue nationale contre le cancer (comit,"Inhibition of Chondrosarcoma Growth by mTOR Inhibitor in an In Vivo Syngeneic Rat Model",1,278742,NA,NA,NA,"2012-06-27","Inhibition of Chondrosarcoma Growth by mTOR Inhibitor in an In Vivo Syngeneic Rat Model",0,0,0,0,0,0,0,0,0,0,0,0,282,53,5,340,126,52,178,0,0,0,0,0,0,0,0,0,0,0
"10.1371/journal.pone.0032466","PLoS ONE","16/03/2012","Research Article","The research leading to these results has received funding from the European Union Seventh Framework Programme (FP7/2007- 2013) under grant agreement no. 269921 (BrainScaleS). AL is supported by the Ramon y Cajal program from the Spanish government. The funders had no role in study design, data collection and analysis, decision to publish, or preparation of the manuscript.","When Two Become One: The Limits of Causality Analysis of Brain Dynamics",1,269921,NA,NA,NA,"2012-03-16","When Two Become One: The Limits of Causality Analysis of Brain Dynamics",0,2,1,2,1,0,0,0,0,0,0,0,1051,265,45,1361,84,39,123,22,0,22,0,0,0,0,0,0,0,0
"10.1371/journal.pone.0032467","PLoS ONE","20/03/2012","Research Article","MDL was supported by a Carnegie/Caledonian Scholarship from The Carnegie Trust. KMT was supported by the European Marie Curie Initial Training Network, FINSysB (PITN-GA-2008-214004). This work was also supported by grants from the UK Biotechnology and Biological Research Council (BB/D009308/1; BB/F00513X/1), the Wellcome Trust (080088) and the European Commission (Unicellsys, HEALTH-2007-201142; FINSysB, PITN-GA-2008-214004; STRIFE, ERC-2009-AdG-249793). The funders had no role in study design, data collection and analysis, decision to publish, or preparation of the manuscript.","Modelling the Regulation of Thermal Adaptation in <i>Candida albicans</i>, a Major Fungal Pathogen of Humans",1,201142,214004,249793,NA,"2012-03-20","Modelling the Regulation of Thermal Adaptation in <italic>Candida albicans</italic>, a Major Fungal Pathogen of Humans",0,0,1,1,0,0,0,0,0,0,0,0,636,201,34,871,198,135,333,0,0,0,0,0,0,0,0,0,0,0
"10.1371/journal.pone.0032489","PLoS ONE","14/03/2012","Research Article","This work was supported by the Champalimaud Neuroscience Programme and European Research Council (STG 243393). CA and VBP are supported by a postdoctoral fellowship from the portuguese Funda,"Chronic <i>Toxoplasma</i> Infection Modifies the Structure and the Risk of Host Behavior",1,243393,NA,NA,NA,"2012-03-14","Chronic <italic>Toxoplasma</italic> Infection Modifies the Structure and the Risk of Host Behavior",0,0,0,0,0,0,0,0,0,9,0,0,1919,313,48,2280,365,223,588,12,0,12,0,0,0,0,0,0,0,0
"10.1371/journal.pone.0032507","PLoS ONE","29/02/2012","Research Article","This study was financially supported by the European Community's Seventh Framework Programme under grant agreements n,"Genetic Diversity and Population Structure of <i>Saccharomyces cerevisiae</i> Strains Isolated from Different Grape Varieties and Winemaking Regions",1,232454,289603,NA,NA,"2012-02-29","Genetic Diversity and Population Structure of <italic>Saccharomyces cerevisiae</italic> Strains Isolated from Different Grape Varieties and Winemaking Regions",0,0,0,1,0,0,0,0,0,0,0,0,761,245,38,1044,217,113,330,0,0,0,0,0,0,0,0,0,0,0
"10.1371/journal.pone.0032559","PLoS ONE","20/03/2012","Research Article","This work was financially supported by the Austrian Science Fund (FWF): P22889-B11 and from the European Union Seventh Framework Programme (FP7/2007,"Discovery of Defense- and Neuropeptides in Social Ants by Genome-Mining",1,254897,NA,NA,NA,"2012-03-20","Discovery of Defense- and Neuropeptides in Social Ants by Genome-Mining",0,0,3,4,1,0,0,0,0,7,0,0,979,227,40,1246,266,151,417,9,0,9,0,0,0,0,0,0,0,0
"10.1371/journal.pone.0032578","PLoS ONE","02/03/2012","Research Article","This work was supported by the EC MacroSys project ref number FP7-KBBE-2007-1-1-2-211602, and partially by the Cariplo Foundation for research support. Funding for GM was provided by the EC MacroSys project ref number FP7-KBBE-2007-1-1-2-211602 and JLW and FS were funded by the Cariplo Foundation for research support. The funders had no role in study design, data collection and analysis, decision to publish, or preparation of the manuscript.","Meta-Analysis of Two Genome-Wide Association Studies of Bovine Paratuberculosis",1,211602,NA,NA,NA,"2012-03-02","Meta-Analysis of Two Genome-Wide Association Studies of Bovine Paratuberculosis",0,0,0,0,0,0,0,0,0,0,0,0,679,203,47,929,228,137,365,5,0,5,0,0,0,0,0,0,0,0
"10.1371/journal.pone.0032646","PLoS ONE","29/02/2012","Research Article","This work was supported by a Marie Curie Reinstallation grant (http://cordis.europa.eu/fp7/people/) [PIRG02-GA-2007-224874], by grants from the Funda,"A Rapid FACS-Based Strategy to Isolate Human Gene Knockin and Knockout Clones",1,224874,NA,NA,NA,"2012-02-29","A Rapid FACS-Based Strategy to Isolate Human Gene Knockin and Knockout Clones",0,0,0,0,0,0,0,0,0,0,0,0,685,208,33,926,115,58,173,5,1,6,0,0,0,0,0,0,0,0
"10.1371/journal.pone.0032659","PLoS ONE","12/03/2012","Research Article","This work was partially supported by the European Commission preDiCT grant (DG-INFSO-224381), by the Plan Nacional de Investigaci,"Simulation and Mechanistic Investigation of the Arrhythmogenic Role of the Late Sodium Current in Human Heart Failure",1,224381,NA,NA,NA,"2012-03-12","Simulation and Mechanistic Investigation of the Arrhythmogenic Role of the Late Sodium Current in Human Heart Failure",0,0,0,0,0,0,0,0,0,0,0,0,399,177,33,609,178,114,292,0,0,0,0,0,0,0,0,0,0,0
"10.1371/journal.pone.0032678","PLoS ONE","05/03/2012","Research Article","The research leading to these results has received funding from the European Union,"Charting the NF-,1,223576,259679,NA,NA,"2012-03-05","Charting the NF-?B Pathway Interactome Map",0,3,2,1,0,0,0,0,0,0,0,0,967,366,45,1378,319,185,504,9,0,9,0,0,0,0,0,0,0,0
"10.1371/journal.pone.0032714","PLoS ONE","29/02/2012","Research Article","The project was funded by the Fondo de Investigaci,"In,1,223131,238885,NA,NA,"2012-02-29","In–Depth Characterization of Viral Isolates from Plasma and Cells Compared with Plasma Circulating Quasispecies in Early HIV-1 Infection",0,0,0,1,1,0,0,0,0,0,0,0,1194,223,32,1449,197,132,329,7,0,7,0,0,0,0,0,0,0,0
"10.1371/journal.pone.0032715","PLoS ONE","11/04/2012","Research Article","This work was supported by grants from ,"Specific Roles of Akt iso Forms in Apoptosis and Axon Growth Regulation in Neurons",1,222887,NA,NA,NA,"2012-04-11","Specific Roles of Akt iso Forms in Apoptosis and Axon Growth Regulation in Neurons",0,0,0,0,0,0,0,0,0,0,0,0,645,188,29,862,183,102,285,2,0,2,0,0,0,0,0,0,0,0
"10.1371/journal.pone.0032723","PLoS ONE","28/03/2012","Research Article","For this publication, the research leading to these results received funding from the European Community's Seventh Framework Programme (FP7/2007,"A Genome-Wide Identification Analysis of Small Regulatory RNAs in <i>Mycobacterium tuberculosis</i> by RNA-Seq and Conservation Analysis",1,223681,NA,NA,NA,"2012-03-28","A Genome-Wide Identification Analysis of Small Regulatory RNAs in <italic>Mycobacterium tuberculosis</italic> by RNA-Seq and Conservation Analysis",0,1,0,0,0,0,0,0,0,0,0,0,1017,411,31,1459,307,185,492,21,4,25,1,0,0,0,0,0,0,0
"10.1371/journal.pone.0032724","PLoS ONE","27/02/2012","Research Article","This research was funded by Institut Curie, INCa ,"Deep-Sequencing Protocols Influence the Results Obtained in Small-RNA Sequencing",1,210890,NA,NA,NA,"2012-02-27","Deep-Sequencing Protocols Influence the Results Obtained in Small-RNA Sequencing",0,6,1,2,1,0,0,0,0,0,0,0,1893,617,38,2548,343,214,557,0,0,0,0,0,0,0,0,0,0,0
"10.1371/journal.pone.0032750","PLoS ONE","07/03/2012","Research Article","This work was supported by a GSK Clinician Scientist fellowship to JC and project grants to JC from Yorkshire Cancer Research, Sheffield Hospitals Charitable Trust and from the European Union (European Community's Seventh Framework Programme. Grant Numbers: FP7/2007,"Integrated Epigenome Profiling of Repressive Histone Modifications, DNA Methylation and Gene Expression in Normal and Malignant Urothelial Cells",1,201438,NA,NA,NA,"2012-03-07","Integrated Epigenome Profiling of Repressive Histone Modifications, DNA Methylation and Gene Expression in Normal and Malignant Urothelial Cells",0,0,1,1,1,0,0,0,0,0,1,0,863,383,41,1287,352,233,585,0,0,0,0,0,0,0,0,0,0,0
"10.1371/journal.pone.0032819","PLoS ONE","12/03/2012","Research Article","Vincent Devictor received financial support from the Fondation pour la Recherche sur la Biodiversit,"Relating Habitat and Climatic Niches in Birds",1,226852,NA,NA,NA,"2012-03-12","Relating Habitat and Climatic Niches in Birds",0,0,2,2,0,0,0,0,0,0,0,0,824,283,41,1148,86,39,125,0,0,0,0,0,0,0,0,0,0,0
"10.1371/journal.pone.0032931","PLoS ONE","11/04/2012","Research Article","This research was funded under the following projects: Empathic avatars: input, processing and output of emotional state (EPSRC (Engineering and Physical Sciences Research Council), UK) EP/D505542/1; Visual and Behavioural Fidelity of Virtual Humans with Applications to Bystander Intervention in Violent Emergencies (EPSRC, UK) EP/F032420/1 (http://www.epsrc.ac.uk); PRESENCCIA funded under the European Sixth Framework Program, Future and Emerging Technologies (FET), Contract Number 27731 (http://cordis.europa.eu/fp7/ict/programme/fet_en.html); and TRAVERSE funded by the European Research Council (ERC) (under the Advanced Grant scheme), grant agreement number 227985. The funders had no role in study design, data collection and analysis, decision to publish, or preparation of the manuscript.","Socially Anxious and Confident Men Interact with a Forward Virtual Woman: An Experimental Study",1,227985,NA,NA,NA,"2012-04-11","Socially Anxious and Confident Men Interact with a Forward Virtual Woman: An Experimental Study",0,1,0,0,0,0,0,0,0,10,0,21,1279,122,20,1421,176,48,224,0,0,0,0,0,0,0,0,0,0,0
"10.1371/journal.pone.0032942","PLoS ONE","06/03/2012","Research Article","This work was supported by grants from The Netherlands Organisation for Scientific Research through NWO-VENI grant 91610121 (DB) and ZonMw grant 91209010 (XW and GB) and EU FP7 grant Antiresdev 241446 (BK). The funders had no role in study design, data collection and analysis, decision to publish, or preparation of the manuscript.","Deep Sequencing Analyses of Low Density Microbial Communities: Working at the Boundary of Accurate Microbiota Detection",1,241446,NA,NA,NA,"2012-03-06","Deep Sequencing Analyses of Low Density Microbial Communities: Working at the Boundary of Accurate Microbiota Detection",0,2,0,2,2,0,0,0,0,0,0,0,1139,390,53,1582,412,199,611,23,2,25,0,0,1,0,0,0,0,0
"10.1371/journal.pone.0032949","PLoS ONE","05/03/2012","Research Article","This work was funded in part by a grant from the European seventh framework programme (HEALTH,"In Vitro Neutralisation of Rotavirus Infection by Two Broadly Specific Recombinant Monovalent Llama-Derived Antibody Fragments",1,202162,NA,NA,NA,"2012-03-05","In Vitro Neutralisation of Rotavirus Infection by Two Broadly Specific Recombinant Monovalent Llama-Derived Antibody Fragments",0,0,0,0,0,0,0,0,0,2,1,0,507,144,38,689,165,81,246,3,0,3,0,0,0,0,0,0,0,0
"10.1371/journal.pone.0032978","PLoS ONE","06/03/2012","Research Article","This work was supported in part by grants from UTE project of Centro de Investigaci,"Renal Failure Affects the Enzymatic Activities of the Three First Steps in Hepatic Heme Biosynthesis in the Acute Intermittent Porphyria Mouse",1,261506,NA,NA,NA,"2012-03-06","Renal Failure Affects the Enzymatic Activities of the Three First Steps in Hepatic Heme Biosynthesis in the Acute Intermittent Porphyria Mouse",0,0,0,0,0,0,0,0,0,0,0,0,509,137,52,698,235,148,383,0,0,0,0,0,0,0,0,0,0,0
"10.1371/journal.pone.0032999","PLoS ONE","07/03/2012","Research Article","This work was supported by the German Research Foundation (SFB-TRR57 P06 and P09, Ta434/2-1), a starting grant of the European Research Council within the FP 7 (ERC-2007-Stg/208237-Luedde-Med3-Aachen), the Interdisciplinary Centre for Clinical Research (IZKF) ,"Micro-RNA Profiling in Human Serum Reveals Compartment-Specific Roles of miR-571 and miR-652 in Liver Cirrhosis",1,208237,NA,NA,NA,"2012-03-07","Micro-RNA Profiling in Human Serum Reveals Compartment-Specific Roles of miR-571 and miR-652 in Liver Cirrhosis",0,0,1,2,1,0,0,0,0,0,0,1,847,366,39,1252,571,362,933,5,0,5,1,0,0,0,0,0,0,0
