"doi","journal","publication_date.x","article_type","financial_disclosure","title_display","score","grantID1","grantID2","grantID3","grantID4","publication_date.y","title","biod","citeulike","crossref","scopus","pubmed","researchblogging","nature","bloglines","postgenomic","facebook","twitter","wikipedia","counter_html","counter_pdf","counter_xml","counter","pmc_html","pmc_pdf","pmc","mendeley_readers","mendeley_groups","mendeley","comments","comment_replies","notes","note_replies","ratings","avg_rating","rating_comments","trackbacks"
"10.1371/journal.pone.0006972","PLoS ONE","22/09/2009","Research Article","This work was supported in part by grants to: AT from the Swiss National Science Foundation, the Swiss Cancer League and the EU-FP7 Program ,"Estimating Dormant and Active Hematopoietic Stem Cell Kinetics through Extensive Modeling of Bromodeoxyuridine Label-Retaining Cell Dynamics",1,200720,NA,NA,NA,"2009-09-22","Estimating Dormant and Active Hematopoietic Stem Cell Kinetics through Extensive Modeling of Bromodeoxyuridine Label-Retaining Cell Dynamics",0,0,11,13,1,0,0,0,0,1,0,0,1906,639,21,2566,503,307,810,19,1,20,0,0,0,0,0,0,0,0
"10.1371/journal.pone.0007004","PLoS ONE","15/09/2009","Research Article","This work was carried out at Human Behaviour Laboratory of Italian Institute of Technology and it was supported by a grant of Italian Ministry of Scientific Research and Ministry of Economy. This work is partly supported by the EU grant FP7-ICT-271724 (HUMOUR). The funders had no role in study design, data collection and analysis, decision to publish, or preparation of the manuscript.","Eye-Hand Coordination during Dynamic Visuomotor Rotations",1,231724,NA,NA,NA,"2009-09-15","Eye-Hand Coordination during Dynamic Visuomotor Rotations",0,0,1,4,0,0,0,0,0,1,0,0,1216,241,21,1478,353,191,544,15,1,16,0,0,0,0,0,0,0,0
"10.1371/journal.pone.0007323","PLoS ONE","02/10/2009","Research Article","The study was supported by the National Graduate School in Informational and Structural Biology (ISB), TRANSCENDO project of the Tekes MASI Program, DIAPREPP project of the Seventh Framework Program of the European Community (HEALTH-F2-2008-202013), and the research program ,"Detection of Molecular Paths Associated with Insulitis and Type 1 Diabetes in Non-Obese Diabetic Mouse",1,202013,NA,NA,NA,"2009-10-02","Detection of Molecular Paths Associated with Insulitis and Type 1 Diabetes in Non-Obese Diabetic Mouse",0,1,5,9,0,0,0,0,0,0,0,0,1796,277,17,2090,445,230,675,7,0,7,0,0,0,0,0,0,0,0
"10.1371/journal.pone.0007496","PLoS ONE","16/10/2009","Research Article","EU FP7 project EDICT European Drug Initiative on Channels and Transporters Grant number 201924(AM), Deutsche Forschungsgemeinschaft Th558/19-1 (GT), NIH-NINDS (DLM), McKnight Foundation for Neuroscience (DLM). The funders had no role in the study design, data collection and analysis, decision to publish, or preparation of the manuscript.","Selection of Inhibitor-Resistant Viral Potassium Channels Identifies a Selectivity Filter Site that Affects Barium and Amantadine Block",1,201924,NA,NA,NA,"2009-10-16","Selection of Inhibitor-Resistant Viral Potassium Channels Identifies a Selectivity Filter Site that Affects Barium and Amantadine Block",0,0,3,7,2,0,0,0,0,0,0,0,1073,252,21,1346,288,114,402,7,1,8,0,0,0,0,0,0,0,0
"10.1371/journal.pone.0007507","PLoS ONE","19/10/2009","Research Article","This work was supported by the Deutsche Forschungsgemeinschaft (DFG, grants Se837/5-2, Se837/6-1, Se837/7-1), the German Ministry of Education and Research (BMBF grant 0314106), the European Union grants LSHG-CT-512036 and EU HEALTH-F2-2008-200234, and a contribution of the Tistou and Charlotte Kerstan Foundation to the OCT equipment. The funders had no role in study design, data collection and analysis, decision to publish, or preparation of the manuscript.","Noninvasive, <i>In Vivo</i> Assessment of Mouse Retinal Structure Using Optical Coherence Tomography",1,200234,NA,NA,NA,"2009-10-19","Noninvasive, <italic>In Vivo</italic> Assessment of Mouse Retinal Structure Using Optical Coherence Tomography",0,0,23,43,17,0,0,0,0,0,0,0,3342,859,29,4230,684,342,1026,27,1,28,0,0,0,0,1,4.66666666666667,0,0
"10.1371/journal.pone.0007511","PLoS ONE","20/10/2009","Research Article","This work was supported by the Framework Program 7 (FP7) of the European Community, program Life Science Health B (LSHB-CT-2008- 223317, LIV-ES) and through grants from Lille and Alfy Nathan, Barbara Fox Miller and the Horowitz and the Wolfson Foundations. The funders had no role in study design, data collection and analysis, decision to publish, or preparation of the manuscript.","Comprehensive Gene and microRNA Expression Profiling Reveals a Role for microRNAs in Human Liver Development",1,223317,NA,NA,NA,"2009-10-20","Comprehensive Gene and microRNA Expression Profiling Reveals a Role for microRNAs in Human Liver Development",0,2,13,20,9,0,0,0,0,0,0,0,2801,947,20,3768,1352,676,2028,30,1,31,0,0,0,0,0,0,0,0
"10.1371/journal.pone.0007538","PLoS ONE","21/10/2009","Research Article","This work was supported in part by the Knowledge Innovation Program of Chinese Academy of Sciences (KSCX2-YW-R-19, KSCX1-YW-22-01), Ministry of Science and Technology of China Grants (2006CB910405, 2006CB910700, 2007AA02Z335 and 2009CB825607), National Natural Science Foundation Grants (30730033, 30670436 and 30600260), Shanghai Postdoctoral Scientific Program (09R21414900). LTR is part of the TB-VIR network (European Community Grants of FP7, 200973). The funders had no role in study design, data collection and analysis, decision to publish, or preparation of the manuscript.","Converting Redox Signaling to Apoptotic Activities by Stress-Responsive Regulators HSF1 and NRF2 in Fenretinide Treated Cancer Cells",1,200973,NA,NA,NA,"2009-10-21","Converting Redox Signaling to Apoptotic Activities by Stress-Responsive Regulators HSF1 and NRF2 in Fenretinide Treated Cancer Cells",0,1,8,12,2,0,0,0,0,0,0,0,2095,534,16,2645,570,286,856,8,0,8,0,0,0,0,0,0,0,0
"10.1371/journal.pone.0007592","PLoS ONE","26/10/2009","Research Article","This study was supported by grants from MICINN, FISS, Generalitat de Catalunya (SGR2009-366), Junta de Andaluc,"Regulation of GABA<sub>A</sub> and Glutamate Receptor Expression, Synaptic Facilitation and Long-Term Potentiation in the Hippocampus of Prion Mutant Mice",1,222887,NA,NA,NA,"2009-10-26","Regulation of GABA<sub>A</sub> and Glutamate Receptor Expression, Synaptic Facilitation and Long-Term Potentiation in the Hippocampus of Prion Mutant Mice",0,2,4,0,1,1,0,0,0,0,0,0,2039,560,18,2617,836,479,1315,18,1,19,0,0,1,0,0,0,0,0
"10.1371/journal.pone.0007663","PLoS ONE","04/11/2009","Research Article","Internationale Stichting Alzheimer Onderzoek (ISAO; 04511; EH) - www.alzheimer.nl/ Hersenstichting Nederland (HsN; 13F05.08; EH) - www.hersenstichting.nl Internationaal Parkinson Fonds (EH) - www.parkinsonfonds.nl Dorpmans-Wigmans-Stichting (EH) EU FP7 project NeuroGlia (Grant Agreement N,"Specific Human Astrocyte Subtype Revealed by Affinity Purified GFAP<sup>+1</sup> Antibody; Unpurified Serum Cross-Reacts with Neurofilament-L in Alzheimer",1,202167,NA,NA,NA,"2009-11-04","Specific Human Astrocyte Subtype Revealed by Affinity Purified GFAP<sup>+1</sup> Antibody; Unpurified Serum Cross-Reacts with Neurofilament-L in Alzheimer",0,0,5,7,1,0,0,0,0,9,0,0,1737,358,19,2114,605,337,942,6,0,6,0,0,0,0,0,0,0,0
"10.1371/journal.pone.0007677","PLoS ONE","02/11/2009","Research Article","This study was supported by the Swedish Research Council (12660 and 8693), the Swedish Heart-Lung foundation (20060425), the European Commission (LSHM-CT-2007-037273), the Knut and Alice Wallenberg Foundation, the European Commission (FAD-200647), DASTI (Danish Agency for Science, Technology and Innovation) and a donation by Fredrik Lundberg. The funders had no role in study design, data collection and analysis, decision to publish, or preparation of the manuscript.","Relationship between CAD Risk Genotype in the Chromosome 9p21 Locus and Gene Expression. Identification of Eight New <i>ANRIL</i> Splice Variants",1,200647,NA,NA,NA,"2009-11-02","Relationship between CAD Risk Genotype in the Chromosome 9p21 Locus and Gene Expression. Identification of Eight New <italic>ANRIL</italic> Splice Variants",0,0,12,34,11,0,0,0,0,1,0,1,1630,523,17,2170,645,392,1037,12,0,12,0,0,0,0,0,0,0,0
"10.1371/journal.pone.0007753","PLoS ONE","13/11/2009","Research Article","This study was funded in part by the United States Agency for International Development (USAID) through a grant awarded to the UNICEF/UNDP/World Bank/WHO Special Programme for Research and Training in Tropical Diseases [TDR] (Grant AAGG-00-99-00005-31) and by the Canadian Institutes of Health Research (CIHR grant MOP-89918) and European Commission (TBSusgent grant, EU-FP7). MP is a recipient of a CIHR New Investigator Award and a FRSQ grant (subvention d',"Quality and Reporting of Diagnostic Accuracy Studies in TB, HIV and Malaria: Evaluation Using QUADAS and STARD Standards",1,223340,NA,NA,NA,"2009-11-13","Quality and Reporting of Diagnostic Accuracy Studies in TB, HIV and Malaria: Evaluation Using QUADAS and STARD Standards",0,1,9,18,5,0,0,0,0,0,0,0,2862,689,20,3571,557,352,909,22,1,23,0,0,0,0,0,0,0,0
"10.1371/journal.pone.0007852","PLoS ONE","18/11/2009","Research Article","This work was supported by BBSRC grant BBC5185731 (GKT/RJB) and the European Research Council under the European Community's Seventh Framework Programme (FP7/2007-2013)/ERC grant agreement no. 204513 to GKT. RJB holds an EPSRC Career Acceleration Fellowship and a supernumerary fellowship at St Anne's College, Oxford. SMW was supported by EPSRC grant GR/S23049/01 under the EPSRC-MoD Joint Grant Scheme. GKT is a Royal Society University Research Fellow and RCUK Academic Fellow at Jesus College, Oxford. The funders had no role in study design, data collection and analysis, decision to publish, or preparation of the manuscript. http://www.bbsrc.ac.uk/ http://www.epsrc.ac.uk/ http://www.rcuk.ac.uk/ http://royalsociety.org/ http://www.epsrc.ac.uk/ http://www.rcuk.ac.uk/ http://royalsociety.org/","The Typical Flight Performance of Blowflies: Measuring the Normal Performance Envelope of <i>Calliphora vicina</i> Using a Novel Corner-Cube Arena",1,204513,NA,NA,NA,"2009-11-18","The Typical Flight Performance of Blowflies: Measuring the Normal Performance Envelope of <italic>Calliphora vicina</italic> Using a Novel Corner-Cube Arena",0,0,4,4,1,0,0,0,0,0,0,0,1035,178,21,1234,77,46,123,5,0,5,0,0,0,0,0,0,0,0
"10.1371/journal.pone.0008127","PLoS ONE","02/12/2009","Research Article","The work reported in this manuscript was partially financed by the European Commission Seventh Framework Programme Project AMPHORA (Alcohol Measures for Public Health Research Alliance), project number 223059, granted to the Hospital Clinic de Barcelona (http://www.amphoraproject.net). The funders had no role in study design, data collection and analysis, decision to publish, or preparation of the manuscript.","Chemical Analysis and Risk Assessment of Diethyl Phthalate in Alcoholic Beverages with Special Regard to Unrecorded Alcohol",1,223059,NA,NA,NA,"2009-12-02","Chemical Analysis and Risk Assessment of Diethyl Phthalate in Alcoholic Beverages with Special Regard to Unrecorded Alcohol",0,1,10,12,1,0,0,0,0,0,0,0,3516,429,19,3964,654,218,872,4,0,4,0,0,0,0,0,0,0,0
"10.1371/journal.pone.0008284","PLoS ONE","14/12/2009","Research Article","This study was supported by grants from Inserm, the 6th Framework programme Anabonos (EC Contract No: LSHM-CT-2003-503020) and the 7th Framework programme Talos (EC Contract No: HEALTH-F2-2008-201099). The funders had no role in study design, data collection and analysis, decision to publish, or preparation of the manuscript.","N-Cadherin Negatively Regulates Osteoblast Proliferation and Survival by Antagonizing Wnt, ERK and PI3K/Akt Signalling",1,201099,NA,NA,NA,"2009-12-14","N-Cadherin Negatively Regulates Osteoblast Proliferation and Survival by Antagonizing Wnt, ERK and PI3K/Akt Signalling",0,0,11,5,3,0,0,0,0,0,0,0,1824,745,21,2590,956,540,1496,10,0,10,0,0,0,0,0,0,0,0
"10.1371/journal.pone.0008433","PLoS ONE","03/02/2010","Research Article","Financed in part by the European Community (FP7/2007-2013; grant agreement n,"Genetically-Defined Deficiency of Mannose-Binding Lectin Is Associated with Protection after Experimental Stroke in Mice and Outcome in Human Stroke",1,201024,NA,NA,NA,"2010-02-03","Genetically-Defined Deficiency of Mannose-Binding Lectin Is Associated with Protection after Experimental Stroke in Mice and Outcome in Human Stroke",0,0,15,20,5,0,0,0,0,0,1,0,2132,413,20,2565,745,442,1187,10,0,10,0,0,0,0,0,0,0,0
"10.1371/journal.pone.0008549","PLoS ONE","06/01/2010","Research Article","This work was funded by Academy of Finland 118654, 116056, and 119553; Sigrid Juselius Foundation; Tampere University Hospital Medical Research Fund 9F021; European Union LSHM-CT-2004-503116; and European Research Council 232738. The funders had no role in study design, data collection and analysis, decision to publish, or preparation of the manuscript.","Gene Expression in a <i>Drosophila</i> Model of Mitochondrial Disease",1,232738,NA,NA,NA,"2010-01-06","Gene Expression in a <italic>Drosophila</italic> Model of Mitochondrial Disease",0,0,3,9,5,0,0,0,0,0,0,0,3554,806,20,4380,819,351,1170,0,0,0,0,0,0,0,0,0,0,0
"10.1371/journal.pone.0008618","PLoS ONE","08/01/2010","Research Article","This work was supported by grants from the European Union 7th Framework Programme (FP7-HEALTH-F2M-2007-201600; MemStick) and the Swiss National Science Foundation (310000-120791). The funders had no role in study design, data collection and analysis, decision to publish, or preparation of the manuscript.","Role of the Amygdala in Antidepressant Effects on Hippocampal Cell Proliferation and Survival and on Depression-like Behavior in the Rat",1,201600,NA,NA,NA,"2010-01-08","Role of the Amygdala in Antidepressant Effects on Hippocampal Cell Proliferation and Survival and on Depression-like Behavior in the Rat",0,0,16,19,5,0,0,0,0,0,0,0,2696,752,24,3472,1410,745,2155,34,0,34,0,0,0,0,0,0,0,0
"10.1371/journal.pone.0008734","PLoS ONE","15/01/2010","Research Article","This work was supported by grants from Istituto Superiore di Sanit,"<i>Bordetella pertussis</i> Commits Human Dendritic Cells to Promote a Th1/Th17 Response through the Activity of Adenylate Cyclase Toxin and MAPK-Pathways",1,201502,NA,NA,NA,"2010-01-15","<italic>Bordetella pertussis</italic> Commits Human Dendritic Cells to Promote a Th1/Th17 Response through the Activity of Adenylate Cyclase Toxin and MAPK-Pathways",0,0,8,13,5,0,0,0,0,0,0,0,1396,427,19,1842,725,464,1189,4,0,4,0,0,0,0,0,0,0,0
"10.1371/journal.pone.0008771","PLoS ONE","19/01/2010","Research Article","This study was supported by the United Kingdom Medical Research Council Centre for Obesity and Related metabolic Disorders (MRC-CORD), the Wellcome Trust, the European Union (FP6: EUGENE2, LSHM-CT-2004-512013 and CLINIGENE, LSHB-CT-2006-018933; FP7 EurOCHIP) and from Ministerio de Ciencia e Innovaci,"Hypothalamic-Specific Manipulation of <i>Fto</i>, the Ortholog of the Human Obesity Gene <i>FTO</i>, Affects Food Intake in Rats",1,241592,NA,NA,NA,"2010-01-19","Hypothalamic-Specific Manipulation of <italic>Fto</italic>, the Ortholog of the Human Obesity Gene <italic>FTO</italic>, Affects Food Intake in Rats",0,1,29,37,19,0,0,0,0,1,0,0,1951,720,24,2695,1003,607,1610,17,1,18,0,0,0,0,0,0,0,0
"10.1371/journal.pone.0008778","PLoS ONE","22/01/2010","Research Article","This work was supported by European Union Framework 7 ICT Project 215910 (BIOTACT, www.biotact.org), and Engineering and Physical Sciences Research Council (www.epsrc.ac.uk) grant EP/P504759/1. The funders had no role in study design, data collection and analysis, decision to publish, or preparation of the manuscript.","Modeling the Emergence of Whisker Direction Maps in Rat Barrel Cortex",1,215910,NA,NA,NA,"2010-01-22","Modeling the Emergence of Whisker Direction Maps in Rat Barrel Cortex",0,3,2,1,1,0,0,0,0,10,0,0,1604,397,20,2021,263,132,395,24,3,27,0,0,0,0,0,0,0,0
"10.1371/journal.pone.0008799","PLoS ONE","20/01/2010","Research Article","This work was generously funded by the Science Foundation of Ireland (08/IN1/1949), the Higher Education Authority (PRTLI Cycle 4), and the European Union (FP6-Mobility, Marie Curie Transfer of Knowledge Fellowships; FP7-Health, APO-SYS). The funders had no role in study design, data collection and analysis, decision to publish, or preparation of the manuscript.","Expanding the Substantial Interactome of NEMO Using Protein Microarrays",1,200767,NA,NA,NA,"2010-01-20","Expanding the Substantial Interactome of NEMO Using Protein Microarrays",0,1,5,8,4,0,0,0,0,0,0,1,1993,652,20,2665,767,400,1167,11,0,11,0,0,0,0,0,0,0,0
"10.1371/journal.pone.0008828","PLoS ONE","22/01/2010","Research Article","This publication has been funded under the PRIMA (Prototypical policy impacts on multifunctional activities in rural municipalities) collaborative project, EU 7th Framework Programme (ENV 2007-1), contract no. 212345. https://prima.cemagref.fr/ The funders had no role in study design, data collection and analysis, decision to publish, or preparation of the manuscript.","An Iterative Approach for Generating Statistically Realistic Populations of Households",1,212345,NA,NA,NA,"2010-01-22","An Iterative Approach for Generating Statistically Realistic Populations of Households",0,1,0,2,1,0,0,0,0,1,0,0,1581,195,19,1795,73,32,105,15,2,17,0,0,0,0,0,0,0,0
"10.1371/journal.pone.0008835","PLoS ONE","21/01/2010","Research Article","This work was supported by the Deutsche Forschungsgemeinschaft (BE-4086/1-1) to CB, the EU FP7 Health IBDase to CB and WS, a start-up grant to CB, and a PhD fellowship to AS from the Johannes Gutenberg-University of Mainz, Germany. The funders had no role in study design, data collection and analysis, decision to publish, or preparation of the manuscript.","Let It Flow: Morpholino Knockdown in Zebrafish Embryos Reveals a Pro-Angiogenic Effect of the Metalloprotease Meprin ,1,200931,NA,NA,NA,"2010-01-21","Let It Flow: Morpholino Knockdown in Zebrafish Embryos Reveals a Pro-Angiogenic Effect of the Metalloprotease Meprin ?<sub>2</sub>",0,0,3,8,5,0,0,0,0,1,0,0,2525,488,21,3034,382,164,546,7,0,7,0,0,0,0,0,0,0,0
"10.1371/journal.pone.0008836","PLoS ONE","21/01/2010","Research Article","Work in the authors' laboratory is supported by European Commission (EC) FP7 funding (ONCOMIRS, grant agreement number 201102. This publication reflects only authors' views. The commission is not liable for any use that may be made of the information herein), The Novo Nordisk Foundation, The Lundbeck Foundation, The Danish National Research Foundation, The Danish Medical Research Council, The Danish Cancer Society and the Danish National Advanced Technology Foundation. The funders had no role in study design, data collection and analysis, decision to publish, or preparation of the manuscript.","MicroRNA-145 Targets <i>YES</i> and <i>STAT1</i> in Colon Cancer Cells",1,201102,NA,NA,NA,"2010-01-21","MicroRNA-145 Targets <italic>YES</italic> and <italic>STAT1</italic> in Colon Cancer Cells",0,4,20,12,12,0,0,0,0,0,0,1,2917,1185,19,4121,1655,1086,2741,16,1,17,0,0,0,0,0,0,0,0
"10.1371/journal.pone.0008869","PLoS ONE","25/01/2010","Research Article","Dr. Pedro Grandes' laboratory is supported by The Basque Country Government grant GIC07/70-IT-432-07, by Red de Trastornos Adictivos (RETICS), Instituto de Salud Carlos III, Ministerio de Ciencia e Innovaci,"Localization and Function of the Cannabinoid CB1 Receptor in the Anterolateral Bed Nucleus of the Stria Terminalis",1,223713,NA,NA,NA,"2010-01-25","Localization and Function of the Cannabinoid CB1 Receptor in the Anterolateral Bed Nucleus of the Stria Terminalis",0,0,6,8,1,0,0,0,0,0,0,1,1794,427,16,2237,495,216,711,17,1,18,0,0,0,0,0,0,0,0
"10.1371/journal.pone.0009215","PLoS ONE","17/02/2010","Research Article","This study was partly funded by AP-HM Public Hospital system and by the FP7 European project n,"Point of Care Strategy for Rapid Diagnosis of Novel A/H1N1 Influenza Virus",1,228292,NA,NA,NA,"2010-02-17","Point of Care Strategy for Rapid Diagnosis of Novel A/H1N1 Influenza Virus",0,0,8,12,2,0,0,0,0,0,0,0,1757,338,16,2111,577,354,931,1,0,1,0,0,0,0,0,0,0,0
"10.1371/journal.pone.0009385","PLoS ONE","25/02/2010","Research Article","This study was supported by the EU-HEALTH project PILGRIM of the 7th Framework Programme (www.fp7-pilgrim.eu). The funders had no role in study design, data collection and analysis, decision to publish, or preparation of the manuscript.","Prevalence of Livestock-Associated MRSA in Communities with High Pig-Densities in The Netherlands",1,223050,NA,NA,NA,"2010-02-25","Prevalence of Livestock-Associated MRSA in Communities with High Pig-Densities in The Netherlands",0,0,17,20,5,0,0,0,0,0,0,0,2300,503,20,2823,587,313,900,3,1,4,0,0,0,0,0,0,0,0
"10.1371/journal.pone.0009471","PLoS ONE","01/03/2010","Research Article","This work was supported by grants from the General Secretariat of Science and Technology, Greek Ministry of Development to K.I. (grant number GR-USA 052); the National Institute of Health (NIAID grant 2R01AI051485-06A1 to H.B. and grant R56AI051485 to H.B. and M.F.W.); the Director's Initiative Fund, UNDP/World Bank/WHO Special Programme for Research and Training in Tropical Diseases (TDR) to P.M.G.; the European Community's Seventh Framework Programme (FP7/2007-2013 to K.I., P.M.G., E.E. and D.F.W. under grant agreement FP7-222927). The funders had a role in study design, data collection and analysis, decision to publish, and preparation of the manuscript.","The <i>Anopheles gambiae</i> Odorant Binding Protein 1 (AgamOBP1) Mediates Indole Recognition in the Antennae of Female Mosquitoes",1,222927,NA,NA,NA,"2010-03-01","The <italic>Anopheles gambiae</italic> Odorant Binding Protein 1 (AgamOBP1) Mediates Indole Recognition in the Antennae of Female Mosquitoes",0,0,17,26,12,0,0,0,0,0,0,0,2359,695,19,3073,507,315,822,21,1,22,0,0,0,0,2,4.5,0,0
"10.1371/journal.pone.0009522","PLoS ONE","04/03/2010","Research Article","This study was supported by the Excellence Initiative of the German Federal and State Governments (EXC 294, Z.Z.) and the European Commission within the seventh Framework Programme, theme 1 Health (UNICELLSYS project, grant agreement no.: 201142, E.K.). The funders had no role in study design, data collection and analysis, decision to publish, or preparation of the manuscript.","A Quantitative Study of the Hog1 MAPK Response to Fluctuating Osmotic Stress in <i>Saccharomyces cerevisiae</i>",1,201142,NA,NA,NA,"2010-03-04","A Quantitative Study of the Hog1 MAPK Response to Fluctuating Osmotic Stress in <italic>Saccharomyces cerevisiae</italic>",0,0,7,12,4,0,0,0,0,0,0,0,1823,467,22,2312,746,248,994,37,7,44,1,0,0,0,0,0,0,0
"10.1371/journal.pone.0009565","PLoS ONE","15/03/2010","Research Article","The authors acknowledge the support of EU-FP7 grant Epiwork, the Israel Science Foundation, and the Israel Ministry of Health. The funders had no role in study design, data collection and analysis, decision to publish, or preparation of the manuscript.","Pandemic Dynamics and the Breakdown of Herd Immunity",1,231807,NA,NA,NA,"2010-03-15","Pandemic Dynamics and the Breakdown of Herd Immunity",0,1,7,0,2,0,0,0,0,0,0,0,2387,451,21,2859,342,169,511,11,2,13,0,0,0,0,0,0,0,0
"10.1371/journal.pone.0009653","PLoS ONE","11/03/2010","Research Article","This work was supported by grants from the European Union Framework Program projects (FP7-2007-2011 ,"Does Plasminogen Activator Inhibitor-1 Drive Lymphangiogenesis?",1,201279,NA,NA,NA,"2010-03-11","Does Plasminogen Activator Inhibitor-1 Drive Lymphangiogenesis?",0,0,5,7,2,0,0,0,0,0,0,0,1179,229,17,1425,438,245,683,7,1,8,0,0,0,0,0,0,0,0
"10.1371/journal.pone.0009724","PLoS ONE","16/03/2010","Research Article","This research was funded by Intra-European Marie Curie Fellowships to JWV and RN from the European Community's Sixth and Seventh Framework Programmes, under grant agreements MEIF-CT-2007-039139 and PIEF-GA-2008-219592, respectively. The funders had no role in study design, data collection and analysis, decision to publish, or preparation of the manuscript.","Transformation of Environmental <i>Bacillus subtilis</i> Isolates by Transiently Inducing Genetic Competence",1,219592,NA,NA,NA,"2010-03-16","Transformation of Environmental <italic>Bacillus subtilis</italic> Isolates by Transiently Inducing Genetic Competence",0,0,2,0,3,0,0,0,0,0,0,0,3796,986,21,4803,880,481,1361,27,1,28,0,0,0,0,0,0,0,0
"10.1371/journal.pone.0009755","PLoS ONE","18/03/2010","Research Article","This work was supported by the Agence Nationale pour la Recherche (French National agency for Research, ANR-08-MNPS-037-01 - SynGen) and European Commission (contract number 222918 - REPLACES - FP7 - Thematic priority HEALTH). The funders had no role in study design, data collection and analysis, decision to publish, or preparation of the manuscript.","Homer1a-Dependent Crosstalk Between NMDA and Metabotropic Glutamate Receptors in Mouse Neurons",1,222918,NA,NA,NA,"2010-03-18","Homer1a-Dependent Crosstalk Between NMDA and Metabotropic Glutamate Receptors in Mouse Neurons",0,0,11,0,3,0,0,0,0,0,0,0,1048,486,14,1548,589,379,968,11,0,11,0,0,0,0,0,0,0,0
