"doi","journal","publication_date.x","article_type","financial_disclosure","title_display","score","grantID1","grantID2","grantID3","grantID4","publication_date.y","title","biod","citeulike","crossref","scopus","pubmed","researchblogging","nature","bloglines","postgenomic","facebook","twitter","wikipedia","counter_html","counter_pdf","counter_xml","counter","pmc_html","pmc_pdf","pmc","mendeley_readers","mendeley_groups","mendeley","comments","comment_replies","notes","note_replies","ratings","avg_rating","rating_comments","trackbacks"
"10.1371/journal.pone.0021605","PLoS ONE","29/06/2011","Research Article","This work was financially supported by the Max-Planck Gesellschaft and the ERC grant 233297, TWOPAN. JMG was supported by an NSF international postdoctoral fellowship (OISE-0754461) during a portion of this research. The funders had no role in study design, data collection and analysis, decision to publish, or preparation of the manuscript.","Bonobos Fall within the Genomic Variation of Chimpanzees",1,233297,NA,NA,NA,"2011-06-29","Bonobos Fall within the Genomic Variation of Chimpanzees",0,5,7,9,3,0,0,0,0,10,1,1,2119,538,24,2681,251,126,377,35,1,36,0,0,0,0,0,0,0,0
"10.1371/journal.pone.0021734","PLoS ONE","06/07/2011","Research Article","This study was financed by Swiss National Science Foundation (SNF) grant 324700-120793 (to H.F.G. and K.J.M.), SNF grants 324730-130865 (to H.F.G.), and an unrestricted research grant from Gilead Sciences Switzerland. The research leading to these results has received further funding from the European Community's Seventh Framework Programme (FP7/2007-2013) under the project ,"Reappearance of Minority K103N HIV-1 Variants after Interruption of ART Initiated during Primary HIV-1 Infection",1,223131,NA,NA,NA,"2011-07-06","Reappearance of Minority K103N HIV-1 Variants after Interruption of ART Initiated during Primary HIV-1 Infection",0,0,0,0,0,0,0,0,0,0,0,0,470,121,15,606,159,89,248,3,0,3,0,0,0,0,0,0,0,0
"10.1371/journal.pone.0021910","PLoS ONE","07/07/2011","Research Article","This work was financially supported by the Swedish Research Council, SNISS, SciLifeLab, Knut & Alice Wallenberg Foundation, and European Community's Seventh Framework Programme (FP7/2007-2013) under grant agreement no. 222913. The funders had no role in study design, data collection and analysis, decision to publish, or preparation of the manuscript.","Scalable Transcriptome Preparation for Massive Parallel Sequencing",1,222913,NA,NA,NA,"2011-07-07","Scalable Transcriptome Preparation for Massive Parallel Sequencing",0,2,1,2,1,0,0,0,0,0,0,0,971,276,23,1270,342,182,524,10,0,10,0,0,0,0,0,0,0,0
"10.1371/journal.pone.0021913","PLoS ONE","13/07/2011","Research Article","This work was supported by grant NS 10/656-3/2009 from the Ministry of Health of the Czech Republic). M. Arbyn was supported by the European Commission (DG of SANCO, Luxembourg, Grand-Duchy of Luxembourg), through the ECCG project (European Cooperation on development and implementation of Cancer screening and prevention Guidelines, IARC, Lyon, France) and the 7th Framework Programme of DG Research of the European Commission through the PREHDICT project (grant No. 242061, coordinated by the Vrije Universiteit Amsterdam, the Netherlands). The funders had no role in study design, data collection and analysis, decision to publish, or preparation of the manuscript.","Human Papillomavirus Genotype Distribution in Czech Women and Men with Diseases Etiologically Linked to HPV",1,242061,NA,NA,NA,"2011-07-13","Human Papillomavirus Genotype Distribution in Czech Women and Men with Diseases Etiologically Linked to HPV",0,0,1,2,0,0,0,0,0,0,0,0,543,154,17,714,569,264,833,2,0,2,0,0,0,0,0,0,0,0
"10.1371/journal.pone.0021928","PLoS ONE","19/07/2011","Research Article","This work was supported by the European Union (SENSOPAC, FP6-IST028056; CEREBNET FP7-ITN238686, REALNET FP7-ICT270434) to ED. The funders had no role in study design, data collection and analysis, decision to publish, or preparation of the manuscript.","Local Field Potential Modeling Predicts Dense Activation in Cerebellar Granule Cells Clusters under LTP and LTD Control",1,238686,270434,NA,NA,"2011-07-19","Local Field Potential Modeling Predicts Dense Activation in Cerebellar Granule Cells Clusters under LTP and LTD Control",0,0,3,3,0,0,0,0,0,0,0,0,857,250,14,1121,189,86,275,11,0,11,0,0,0,0,0,0,0,0
"10.1371/journal.pone.0021940","PLoS ONE","08/07/2011","Research Article","This work was partially supported by Project CONCORD (Ref. FP7-Health-F3-2008-222718) from the European Community to HL and by grant Ref: 053/BI-BTI/2009 from the same Project to OB. Additional funding was provided by project Tunisia-Portugal MESRST/GRICES ref. Proc,"Molecular Epidemiology of Methicillin-Resistant <i>Staphylococcus hominis</i> (MRSHo): Low Clonality and Reservoirs of SCC<i>mec</i> Structural Elements",1,222718,NA,NA,NA,"2011-07-08","Molecular Epidemiology of Methicillin-Resistant <italic>Staphylococcus hominis</italic> (MRSHo): Low Clonality and Reservoirs of SCC<italic>mec</italic> Structural Elements",0,0,0,1,0,0,0,0,0,0,0,0,1378,288,17,1683,405,263,668,4,0,4,0,0,0,0,0,0,0,0
"10.1371/journal.pone.0022006","PLoS ONE","18/07/2011","Research Article","Funding for RH was provided by the European Commission's 7th Framework Programme, RICORDO project, grant number 248502. Funding for MD was provided by an NSERC Discovery Grant. Funding for AO and DRS was provided by the European Bioinformatics Institute. Funding for PS was provided by a National Institutes of Health grant, number R01 HG004838-02. Funding for GG was provided by BBSRC grant BBG0043581. The funders had no role in study design, data collection and analysis, decision to publish, or preparation of the manuscript.","Interoperability between Biomedical Ontologies through Relation Expansion, Upper-Level Ontologies and Automatic Reasoning",1,248502,NA,NA,NA,"2011-07-18","Interoperability between Biomedical Ontologies through Relation Expansion, Upper-Level Ontologies and Automatic Reasoning",0,8,6,6,4,0,0,0,0,0,0,0,946,170,15,1131,95,41,136,19,4,23,0,0,0,0,0,0,0,0
"10.1371/journal.pone.0022007","PLoS ONE","22/07/2011","Research Article","This work is part of the activities of the HIV-ACE research network (HEALTH-F3-2008-201095) supported by a grant of the European Commission within the Priority 1 ,"A SNAP-Tagged Derivative of HIV-1,1,201095,NA,NA,NA,"2011-07-22","A SNAP-Tagged Derivative of HIV-1—A Versatile Tool to Study Virus-Cell Interactions",0,0,3,6,3,0,0,0,0,0,0,0,938,348,15,1301,266,134,400,4,1,5,0,0,0,0,0,0,0,0
"10.1371/journal.pone.0022051","PLoS ONE","20/07/2011","Research Article","OS is the recipient of a Fondation Merieux and a French Cooperation Institute fellowship. This work is funded by an ANR grant to CB (ANR Piribio R09127AA) and by the ANR, partner of the ERASysbio+ initiative supported under the EU ERANET Plus scheme in FP7 (ModHeart Project). The funders had no role in study design, data collection and analysis, decision to publish, or preparation of the manuscript.","Functional Integrative Levels in the Human Interactome Recapitulate Organ Organization",1,235447,NA,NA,NA,"2011-07-20","Functional Integrative Levels in the Human Interactome Recapitulate Organ Organization",0,3,2,2,1,0,0,0,0,0,0,0,667,138,18,823,121,50,171,9,0,9,0,0,0,0,0,0,0,0
"10.1371/journal.pone.0022099","PLoS ONE","05/08/2011","Research Article","This project was funded under the EU 7th Framework Programme (number: HEALTH-F4-2007-201052). CJC is funded under the Science Foundation Ireland (SFI) Stokes Lecturer Scheme (number: 07/SK/B1236A). The funders had no role in study design, data collection and analysis, decision to publish, or preparation of the manuscript.","Universally Distributed Single-Copy Genes Indicate a Constant Rate of Horizontal Transfer",1,201052,NA,NA,NA,"2011-08-05","Universally Distributed Single-Copy Genes Indicate a Constant Rate of Horizontal Transfer",0,2,4,4,4,0,0,0,0,11,0,0,1070,353,139,1562,155,101,256,20,1,21,0,0,0,0,0,0,0,0
"10.1371/journal.pone.0022107","PLoS ONE","13/07/2011","Research Article","This work was supported by the Swiss National Science Foundation (31003A_129962/1). D. Hoogewijs is a recipient of a Marie Curie Intra-European Fellowship from the European Commission (PIEF-GA-2009-236157-HYDRELZ). V.G. Panse is supported by the Swiss National Science Foundation, the ETH Z,"The Putative RNA Helicase HELZ Promotes Cell Proliferation, Translation Initiation and Ribosomal Protein S6 Phosphorylation",1,236157,260676,NA,NA,"2011-07-13","The Putative RNA Helicase HELZ Promotes Cell Proliferation, Translation Initiation and Ribosomal Protein S6 Phosphorylation",0,0,1,1,0,0,0,0,0,0,0,0,469,150,15,634,234,85,319,4,0,4,0,0,0,0,0,0,0,0
"10.1371/journal.pone.0022159","PLoS ONE","15/07/2011","Research Article","Partially funded by European Commission Information, Society and Media Future and Emergent Technologies (FET) Grant # 231845 and PEDECIBA (Uruguay). No additional external funding received for this study. The funders had no role in study design, data collection and analysis, decision to publish, or preparation of the manuscript.","Timing Actions to Avoid Refractoriness: A Simple Solution for Streaming Sensory Signals",1,231845,NA,NA,NA,"2011-07-15","Timing Actions to Avoid Refractoriness: A Simple Solution for Streaming Sensory Signals",0,2,0,1,0,0,0,0,0,0,0,0,328,73,17,418,55,26,81,3,0,3,0,0,0,0,0,0,0,0
"10.1371/journal.pone.0022166","PLoS ONE","26/07/2011","Research Article","This work was supported by the Fondazione Telethon, the Italian Ministry of Health and the European Commission grants ,"MicroRNA-Restricted Transgene Expression in the Retina",1,223445,231068,242013,NA,"2011-07-26","MicroRNA-Restricted Transgene Expression in the Retina",0,0,3,1,1,0,0,0,0,0,0,0,902,359,21,1282,524,351,875,9,0,9,0,0,0,0,0,0,0,0
"10.1371/journal.pone.0022200","PLoS ONE","14/07/2011","Research Article","The research leading to these results has received funding from the European Community's Seventh Framework Programme (FP7/2007,"USP18-Based Negative Feedback Control Is Induced by Type I and Type III Interferons and Specifically Inactivates Interferon ,1,223608,NA,NA,NA,"2011-07-14","USP18-Based Negative Feedback Control Is Induced by Type I and Type III Interferons and Specifically Inactivates Interferon ? Response",0,0,7,4,0,0,0,0,0,0,0,0,981,387,18,1386,503,323,826,18,0,18,0,0,0,0,0,0,0,0
"10.1371/journal.pone.0022207","PLoS ONE","27/07/2011","Research Article","This work was supported by a European Union grant by the 7th Framework Programme, Theme 3: Science of complex systems for socially intelligent ICT. It is part of the CyberEmotions (Collective Emotions in Cyberspace) project (contract 231323). The work was also supported by Polish Ministry of Science Grant 1029/7.PR UE/2009/7. The funders had no role in study design, data collection and analysis, decision to publish, or preparation of the manuscript.","Collective Emotions Online and Their Influence on Community Life",1,231323,NA,NA,NA,"2011-07-27","Collective Emotions Online and Their Influence on Community Life",0,0,5,8,4,0,0,0,0,7,0,0,3159,437,21,3617,298,75,373,25,2,27,0,0,0,0,0,0,0,0
"10.1371/journal.pone.0022220","PLoS ONE","18/07/2011","Research Article","This study was supported by the following project: RECOGNITION: Relevance and Cognition for Self-Awareness in a Content-Centric Internet (257756), which is funded by the European Commission within the 7th Framework Programme (FP7). The funders had no role in study design, data collection and analysis, decision to publish, or preparation of the manuscript.","Community Structure in Social Networks: Applications for Epidemiological Modelling",1,257756,NA,NA,NA,"2011-07-18","Community Structure in Social Networks: Applications for Epidemiological Modelling",0,0,1,1,0,0,0,0,0,0,0,0,1302,266,21,1589,139,57,196,21,1,22,0,0,3,0,0,0,0,0
"10.1371/journal.pone.0022225","PLoS ONE","14/07/2011","Research Article","This work was supported by a Rapid Innovation Response Award from the Michael J. Fox Foundation to EE and KV. Partial support was obtained from MEFOPA FP7. The funders had no role in study design, data collection and analysis, decision to publish, or preparation of the manuscript.","Assessment of ,1,241791,NA,NA,NA,"2011-07-14","Assessment of ?-Synuclein Secretion in Mouse and Human Brain Parenchyma",0,1,7,11,2,0,0,0,0,0,0,0,949,368,20,1337,483,257,740,3,0,3,0,0,0,0,0,0,0,0
"10.1371/journal.pone.0022319","PLoS ONE","04/08/2011","Research Article","Funding is provided by the Italian Ministery of Education (FIRB) and European Union (FIGHTMAL). The funders had no role in study design, data collection and analysis, decision to publish, or preparation of the manuscript.","Serum IgE Reactivity Profiling in an Asthma Affected Cohort",1,218164,NA,NA,NA,"2011-08-04","Serum IgE Reactivity Profiling in an Asthma Affected Cohort",0,0,0,0,0,0,0,0,0,1,0,0,600,267,133,1000,319,182,501,4,0,4,0,0,0,0,0,0,0,0
"10.1371/journal.pone.0022321","PLoS ONE","21/07/2011","Research Article","This work was partly funded by the European Union FP7 project Opticon (Optical Infrared Coordination Network for Astronomy) to FB, by a grant to FM and FB from Fondazione Cariparo (Progetti di Eccellenza 2006) and by a grant to FM from the University of Padova (Progetti di Ateneo 2009, grant number CPDA094904/09. The funders had no role in study design, data collection and analysis, decision to publish, or preparation of the manuscript.","Multiphoton Fluorescence Microscopy with GRIN Objective Aberration Correction by Low Order Adaptive Optics",1,226604,NA,NA,NA,"2011-07-21","Multiphoton Fluorescence Microscopy with GRIN Objective Aberration Correction by Low Order Adaptive Optics",0,0,1,2,1,0,0,0,0,0,0,0,663,210,19,892,118,39,157,6,0,6,0,0,0,0,0,0,0,0
"10.1371/journal.pone.0022332","PLoS ONE","03/08/2011","Research Article","This work was supported by Guy's and St Thomas' Charity project grant R070719. The TwinsUK resource is supported by the Wellcome Trust; T Andrew is supported by the Medical Research Council UK (New Investigator Award 91993) and the Central Research Fund, University of London (AR/CRF/B); AM Valdes is supported by the EU FP7 large collaborative project 200800 TREAT-OA and by NIH NIDDK R01 grant DK61722. The funders had no role in study design, data collection and analysis, decision to publish, or preparation of the manuscript.","A Twin Study of Mitochondrial DNA Polymorphisms Shows that Heteroplasmy at Multiple Sites Is Associated with mtDNA Variant 16093 but Not with Zygosity",1,200800,NA,NA,NA,"2011-08-03","A Twin Study of Mitochondrial DNA Polymorphisms Shows that Heteroplasmy at Multiple Sites Is Associated with mtDNA Variant 16093 but Not with Zygosity",0,0,1,2,1,0,0,0,0,0,0,0,444,252,126,822,198,113,311,5,1,6,0,0,0,0,0,0,0,0
"10.1371/journal.pone.0022338","PLoS ONE","22/07/2011","Research Article","The research leading to these results has received funding from the European Research Council under the European Union's Seventh Framework Programme (FP7/2007-2013)/ERC grant agreement n,"The Skeletal Organic Matrix from Mediterranean Coral <i>Balanophyllia europaea</i> Influences Calcium Carbonate Precipitation",1,249930,NA,NA,NA,"2011-07-22","The Skeletal Organic Matrix from Mediterranean Coral <italic>Balanophyllia europaea</italic> Influences Calcium Carbonate Precipitation",0,0,2,2,1,0,0,0,0,0,0,0,821,232,17,1070,141,41,182,8,0,8,0,0,0,0,0,0,0,0
"10.1371/journal.pone.0022355","PLoS ONE","01/08/2011","Research Article","The work was conducted within GP's postdoctoral position at the Department of Ecological Modelling, as part of the BioCAPSP project ,"Breaking Functional Connectivity into Components: A Novel Approach Using an Individual-Based Model, and First Outcomes",1,226852,NA,NA,NA,"2011-08-01","Breaking Functional Connectivity into Components: A Novel Approach Using an Individual-Based Model, and First Outcomes",0,0,2,2,0,0,0,0,0,0,0,0,1200,431,245,1876,93,40,133,23,0,23,0,0,0,0,0,0,0,0
"10.1371/journal.pone.0022356","PLoS ONE","12/09/2011","Research Article","MB and SL are holders of a postdoc mandate from the FWO. PV holds a Methusalem grant from the Flemish Government (BOF09/01M00709) and is supported by Flanders Institute for Biotechnology (VIB), Interuniversity Poles of Attraction-Belgian Science Policy (IAP6/18), Fonds voor Wetenschappelijk Onderzoek ,"cIAP1/2 Are Direct E3 Ligases Conjugating Diverse Types of Ubiquitin Chains to Receptor Interacting Proteins Kinases 1 to 4 (RIP1,1,200767,NA,NA,NA,"2011-09-12","cIAP1/2 Are Direct E3 Ligases Conjugating Diverse Types of Ubiquitin Chains to Receptor Interacting Proteins Kinases 1 to 4 (RIP1–4)",0,3,1,2,1,0,0,0,0,0,0,0,1502,697,117,2316,547,320,867,12,0,12,0,0,0,0,0,0,0,0
"10.1371/journal.pone.0022372","PLoS ONE","26/07/2011","Research Article","This work was supported by grants from the Spanish Ministry MICINN (BFU2009-07989) to LMdlP and by the European Commission under FP7 (MemStick Grant Agreement N,"Hippocampal-Dependent Spatial Memory in the Water Maze is Preserved in an Experimental Model of Temporal Lobe Epilepsy in Rats",1,201600,NA,NA,NA,"2011-07-26","Hippocampal-Dependent Spatial Memory in the Water Maze is Preserved in an Experimental Model of Temporal Lobe Epilepsy in Rats",0,1,0,1,1,0,0,0,0,0,0,0,1814,484,17,2315,650,313,963,16,1,17,0,0,0,0,0,0,0,0
"10.1371/journal.pone.0022482","PLoS ONE","10/08/2011","Research Article","The research leading to these results has received funding from the Italian Association for Cancer Research (AIRC) to I.S. (IG grant n,"Serotonin-Mediated Tuning of Human Helper T Cell Responsiveness to the Chemokine CXCL12",1,201106,NA,NA,NA,"2011-08-10","Serotonin-Mediated Tuning of Human Helper T Cell Responsiveness to the Chemokine CXCL12",0,0,0,0,0,0,0,0,0,0,0,0,1003,293,127,1423,325,157,482,8,0,8,0,0,0,0,0,0,0,0
"10.1371/journal.pone.0022495","PLoS ONE","21/07/2011","Research Article","This project was supported in part by grants from the Canadian Institutes for Health Research (CIHR MOP-89918), the European Commission (EU-FP7; TBSusgent), and the EDCTP (TB-NEAT). MP is supported by a CIHR New Investigator Award, DM by a Chercheur-national award, CG by a Chercheur Boursier Clinicen award from the Fonds de Recherche en Sant,"Comparison of LED and Conventional Fluorescence Microscopy for Detection of Acid Fast Bacilli in a Low-Incidence Setting",1,223340,NA,NA,NA,"2011-07-21","Comparison of LED and Conventional Fluorescence Microscopy for Detection of Acid Fast Bacilli in a Low-Incidence Setting",0,0,1,2,1,0,0,0,0,0,0,0,836,186,15,1037,436,171,607,11,1,12,0,0,0,0,0,0,0,0
"10.1371/journal.pone.0022591","PLoS ONE","21/07/2011","Research Article","This work was funded by an NSERC Discovery grant to HKL. AS was supported by NSERC PGSD and Killam Trusts Predoctoral Scholarships, and MC by a postdoctoral fellowship from the Spanish Ministry of Science and Technology, and the European Community Marie-Curie Program through the International Outgoing Fellowships (Call: FP7-PEOPLE-2007-4-1-IOF) to the ECOFUN project. The funders had no role in study design, data collection and analysis, decision to publish, or preparation of the manuscript.","Food-Web Structure of Seagrass Communities across Different Spatial Scales and Human Impacts",1,219265,NA,NA,NA,"2011-07-21","Food-Web Structure of Seagrass Communities across Different Spatial Scales and Human Impacts",0,0,1,1,0,0,0,0,0,0,0,0,1558,338,16,1912,247,94,341,31,2,33,0,0,0,0,0,0,0,0
"10.1371/journal.pone.0022614","PLoS ONE","25/07/2011","Research Article","Funding (1): Nieders,"Overt Visual Attention as a Causal Factor of Perceptual Awareness",1,270212,NA,NA,NA,"2011-07-25","Overt Visual Attention as a Causal Factor of Perceptual Awareness",0,0,0,0,0,0,0,0,0,10,0,0,797,173,19,989,129,68,197,22,1,23,0,0,0,0,0,0,0,0
"10.1371/journal.pone.0022735","PLoS ONE","27/07/2011","Research Article","Funding was provided by an ERC Starging Grant ,"Targeted Ablation of Oligodendrocytes Triggers Axonal Damage",1,204034,NA,NA,NA,"2011-07-27","Targeted Ablation of Oligodendrocytes Triggers Axonal Damage",0,0,1,2,0,0,0,0,0,0,0,0,984,385,18,1387,371,226,597,11,0,11,0,0,0,0,0,0,0,0
"10.1371/journal.pone.0022741","PLoS ONE","25/07/2011","Research Article","Mattias Mild was funded by a post doctoral fellowship grant from The Swedish Research Council. The research leading to these results has received funding from the Swedish Research Council (grant no. 2007-1131-49460-36); Swedish International Development Cooperation Agency (grant no. SWE-2006-018), a non-commercial organization working according to directives of the Swedish Parliament and Government (http://www.sida.se/English/); and the EU projects Europe HIV Resistance (EHR) (LSHP-CT-2006-518211) and CHAIN (FP7/2007-2013) ,"Performance of Ultra-Deep Pyrosequencing in Analysis of HIV-1 <i>pol</i> Gene Variation",1,223131,NA,NA,NA,"2011-07-25","Performance of Ultra-Deep Pyrosequencing in Analysis of HIV-1 <italic>pol</italic> Gene Variation",0,0,1,3,2,0,0,0,0,0,0,0,692,285,12,989,442,243,685,0,0,0,0,0,0,0,0,0,0,0
"10.1371/journal.pone.0022770","PLoS ONE","27/07/2011","Research Article","This study was funded by the European Commission (FINSysB Marie Curie Initial Training 16 Network, PITN-GA-2008-214004) and by a grant from Fondazione Cassa Risparmio Perugia 2009.010.0492. The funders had no role in study design, data collection and analysis, decision to publish, or preparation of the manuscript.","Th17 Cells and IL-17 in Protective Immunity to Vaginal Candidiasis",1,214004,NA,NA,NA,"2011-07-27","Th17 Cells and IL-17 in Protective Immunity to Vaginal Candidiasis",0,0,4,7,2,0,0,0,0,0,0,0,891,369,15,1275,695,499,1194,5,0,5,0,0,0,0,0,0,0,0
"10.1371/journal.pone.0022793","PLoS ONE","18/08/2011","Research Article","This work was partially funded by the European Commission Information, Society and Media, Future and Emerging Technologies (FET) Grant # 231845; Agencia Nacional de Investigaci,"Active Electric Imaging: Body-Object Interplay and Object's ,1,231845,NA,NA,NA,"2011-08-18","Active Electric Imaging: Body-Object Interplay and Object's “Electric Texture”",0,0,3,0,0,0,0,0,0,0,0,0,504,98,21,623,91,31,122,7,2,9,0,0,0,0,0,0,0,0
"10.1371/journal.pone.0022928","PLoS ONE","29/07/2011","Research Article","This work was funded by the European Union through grant FP7/2007-2013 (SYBILLA, to WWAS and TH, www.sybilla-t-cell.de), the Deutsche-Forschungsgemeinschaft through EXC294 (to WWAS, www.bioss.uni-freiburg.de) and the Bundesministerium f,"Quantitative Analysis of Protein Phosphorylations and Interactions by Multi-Colour IP-FCM as an Input for Kinetic Modelling of Signalling Networks",1,201106,NA,NA,NA,"2011-07-29","Quantitative Analysis of Protein Phosphorylations and Interactions by Multi-Colour IP-FCM as an Input for Kinetic Modelling of Signalling Networks",0,0,1,1,0,0,0,0,0,0,0,0,998,263,18,1279,411,204,615,0,0,0,0,0,0,0,0,0,0,0
"10.1371/journal.pone.0022985","PLoS ONE","03/08/2011","Research Article","Support comes from the EU projects THESEUS (EU - FP7 - ENV2009-1, grant 244104) and DELOS (EVK3-CT-2000-00041), The MIAT project MED RED and from the MIUR projects COFIN (ex 40%) and PRIN (BIORES). F.B. was further supported by Assegni di Ricerca of the University of Pisa and University of Sassari, respectively, and L.A. was supported by an Eastern College Consortium (E.C.Co) Scholarship at Wesleyan University. The funders had no role in study design, data collection and analysis, decision to publish, or preparation of the manuscript.","Anthropogenic Disturbance Can Determine the Magnitude of Opportunistic Species Responses on Marine Urban Infrastructures",1,244104,NA,NA,NA,"2011-08-03","Anthropogenic Disturbance Can Determine the Magnitude of Opportunistic Species Responses on Marine Urban Infrastructures",0,0,3,2,0,0,0,0,0,1,0,0,895,437,128,1460,93,36,129,20,2,22,0,0,0,0,0,0,0,0
"10.1371/journal.pone.0023010","PLoS ONE","10/08/2011","Research Article","This research has received support from the Netherlands Organization of Scientific Research and is a contribution to the ,"Effect of Carbonate Chemistry Alteration on the Early Embryonic Development of the Pacific Oyster (<i>Crassostrea gigas</i>)",1,211384,NA,NA,NA,"2011-08-10","Effect of Carbonate Chemistry Alteration on the Early Embryonic Development of the Pacific Oyster (<italic>Crassostrea gigas</italic>)",0,0,6,2,0,0,0,0,0,0,0,0,831,407,122,1360,105,65,170,19,3,22,1,0,0,0,0,0,0,0
"10.1371/journal.pone.0023014","PLoS ONE","18/08/2011","Research Article","This research has received funding from the European Community's Seventh Framework Programme (FP7/2007-2013) under grant agreement no. 223585, the Medical Research Council (grant no. G0601176) and the Wellcome Trust (grant no. WT078131AIA). The funders had no role in study design, data collection and analysis, decision to publish, or preparation of the manuscript.","Genetic Organisation, Mobility and Predicted Functions of Genes on Integrated, Mobile Genetic Elements in Sequenced Strains of <i>Clostridium difficile</i>",1,223585,NA,NA,NA,"2011-08-18","Genetic Organisation, Mobility and Predicted Functions of Genes on Integrated, Mobile Genetic Elements in Sequenced Strains of <italic>Clostridium difficile</italic>",0,0,2,0,5,0,0,0,0,0,0,0,1009,336,19,1364,365,251,616,10,0,10,0,0,0,0,0,0,0,0
"10.1371/journal.pone.0023080","PLoS ONE","05/08/2011","Research Article","This work was supported by grants from the German Ministry for Education and Research (BMBF, ,"Development and Validation of a New Method to Measure Walking Speed in Free-Living Environments Using the Actibelt,1,215820,223865,NA,NA,"2011-08-05","Development and Validation of a New Method to Measure Walking Speed in Free-Living Environments Using the Actibelt® Platform",0,0,1,2,0,0,0,0,0,0,0,0,1059,294,134,1487,277,118,395,9,3,12,0,0,0,0,0,0,0,0
